id;name;acronym;state
14598,94478;FACULDADE DE DIREITO DE ALTA FLORESTA;;MT
14602,81924;FACULDADE MAURÍCIO DE NASSAU DE JOÃO PESSOA;FMN JOÃO PESSOA;PB
14606,6937;INSTITUTO DE EDUCAÇÃO SUPERIOR DE POUSO ALEGRE;FAPA;MG
14610,56816;FACULDADE VASCO DA GAMA;FVG;BA
14614,44262;FACULDADE DE TECNOLOGIA DO UNIUOL;UNIUOL;PB
14618,31707;FACULDADE DE TECNOLOGIA NOVO RUMO;;MG
14622,19153;CENTRO UNIVERSITÁRIO FACVEST;FACVEST;SC
14626,06599;FACULDADE BAIANA DE DIREITO E GESTÃO;;BA
14629,94045;FUNDAÇÃO UNIVERSIDADE FEDERAL DO TOCANTINS;UFT;TO
14633,81491;FACULDADE MAURÍCIO DE NASSAU DE NATAL;FMN NATAL;RN
14637,68937;FACULDADE DAS ÁGUAS EMENDADAS - FAE;FAE;DF
14641,56383;FACULDADE LUCIANO FEIJÃO;FLF;CE
14645,43829;FACULDADE REGIONAL DE ALAGOINHAS;FARAL;BA
14649,31274;FACULDADE BRASILEIRA DE EDUCAÇÃO E CULTURA;FABEC BRASIL;GO
14653,1872;FACULDADE MAUÁ DE BRASÍLIA;MAUADF;DF
14657,06166;INSTITUTO FLORENCE DE ENSINO SUPERIOR;IFES;MA
14660,93612;ESCOLA SUPERIOR PROFESSOR PAULO MARTINS;ESPAM;DF
14664,81058;CENTRO UNIVERSITÁRIO DA FUNDAÇÃO EDUCACIONAL GUAXUPÉ;UNIFEG;MG
14668,68504;AVM - FACULDADE INTEGRADA;IAVM;RJ
14672,5595;FACULDADE BRASIL CENTRAL;FBC;GO
14676,43396;FACULDADE DECISION DE NEGÓCIOS;FACULDADE DECISION;RS
14680,30841;FACULDADE MAURÍCIO DE NASSAU DE CAMPINA GRANDE;FMN CG;PB
14684,18287;FACULDADE DE INTEGRAÇÃO DO SERTÃO;FIS;PE
14688,05733;FACULDADE MUNDIAL;;SP
14691,93179;FACULDADE DE TECNOLOGIA SENAI ROBERTO MANGE;FATEC SENAI RM;GO
14695,80625;FACULDADE ARNALDO HORÁCIO FERREIRA;FAAHF;BA
14699,68071;INSTITUTO DE EDUCAÇÃO SUPERIOR RAIMUNDO SÁ;IESRSA;PI
14703,55517;FACULDADE MÉTODO DE SÃO PAULO;FAMESP;SP
14707,42963;FACULDADE ANHANGUERA DE LIMEIRA;;SP
14711,30408;Faculdade Anhanguera de Indaiatuba;;SP
14715,17854;FACULDADE ALIANÇA;;GO
14719,053;FACULDADE DE ENSINO SUPERIOR SANTA BARBARA;FAESB;SP
14722,92746;FACULDADE DE TECNOLOGIA SENAC TUBARÃO;SENAC;SC
14726,80192;FACULDADE DE TECNOLOGIA SENAC CHAPECÓ;SENAC;SC
14730,67638;FACULDADE DE TECNOLOGIA SENAC BLUMENAU;SENAC;SC
14734,55084;FACULDADE DE TECNOLOGIA LUIZ ADELAR SCHEUER;FATEC- JF;MG
14738,4253;FACULDADE DE CIÊNCIAS JURÍDICAS E GERENCIAIS DE OLIVEIRA;FACIJUGO;MG
14742,29975;FACULDADES INTEGRADAS DE CATAGUASES;FIC;MG
14746,17421;FACULDADE DE TECNOLOGIA SENAI CIMATEC;SENAI CIMATEC;BA
14750,04867;INSTITUTO SUPERIOR DE EDUCAÇÃO CARLOS CHAGAS;ISECC;MG
14753,92313;CENTRO UNIVERSITÁRIO DE CARATINGA;UNEC;MG
14757,79759;CENTRO SUPERIOR DE ENSINO E PESQUISA DE MACHADO;CESEP;MG
14761,67205;UNIVERSIDADE DE RIO VERDE;FESURV;GO
14765,54651;FACULDADE SÃO FRANCISCO DE PIUMHI;FASPI;MG
14769,42097;FACULDADE DE TECNOLOGIA DO AMAPÁ;META;AP
14773,29543;FACULDADE DE TECNOLOGIA PENTÁGONO;FATEP;SP
14777,16988;FACULDADE DE BAURU;-;SP
14781,04434;FACULDADE DE TECNOLOGIA CENACAP;CENACAP;DF
14784,9188;FACULDADE DE TECNOLOGIA INTEGRAL;CETI;PR
14788,79326;CENTRO UNIVERSITÁRIO DE FORMIGA;UNIFORMG;MG
14792,66772;FUNDAÇÃO UNIVERSIDADE FEDERAL DO VALE DO SÃO FRANCISCO;UNIVASF;PE
14796,54218;CENTRO UNIVERSITÁRIO SENAC;SENACSP;SP
14800,41664;INSTITUTO SUPERIOR DE EDUCAÇÃO DO PARANÁ;INSEP;PR
14804,2911;FACULDADE UNIÃO DE GOYAZES;FUG;GO
14808,16555;FACULDADE DE TECNOLOGIA DE JOÃO PESSOA;FATEC;PB
14812,04001;FACULDADE DE TECNOLOGIA ANCHIETA;FTA;SP
14815,91447;FACULDADE DE TECNOLOGIA SÃO MATEUS;FATESM;RO
14819,78893;FACULDADE JK - ASA NORTE;-;DF
14823,66339;FACULDADE DE TECNOLOGIA CETEP;CETEP;PR
14827,53785;FACULDADE EVANGÉLICA CRISTO REI;FECR;PI
14831,41231;FACULDADE SENAC PERNAMBUCO;SENACPE;PE
14835,28677;FACULDADE DE TECNOLOGIA INFNET RIO DE JANEIRO;INSTITUTO INFNET;RJ
14839,16122;FACULDADE DE ENSINO SUPERIOR DO INTERIOR PAULISTA;FAIP;SP
14843,03568;FACULDADE CENECISTA DE SENHOR DO BONFIM;FACESB;BA
14846,91014;FACULDADE DE TECNOLOGIA SENAC PELOTAS;FATEC SENAC PELOTAS;RS
14850,7846;FATECE - FACULDADE DE TECNOLOGIA, CIÊNCIAS E EDUCAÇÃO;FATECE;SP
14854,65906;FACULDADE DE TECNOLOGIA SENAC PASSO FUNDO;SENAC PASSO FUNDO;RS
14858,53352;FACULDADE DE TECNOLOGIA RADIAL CURITIBA;FATEC RADIAL CTBA;PR
14862,40798;CENTRO UNIVERSITÁRIO METODISTA;IPA;RS
14866,28244;FACULDADE ANHANGUERA DE RIO CLARO;;SP
14870,15689;INSTITUTO NACIONAL DE EDUCAÇÃO DE SURDOS;INES;RJ
14874,03135;CENTRO UNIVERSITÁRIO PADRE ANCHIETA;UNIANCHIETA;SP
14877,90581;FACULDADE DE TECNOLOGIA DE BOTUCATU;FATEC BT;SP
14881,78027;FACULDADE DE TECNOLOGIA DE GARÇA;FATECGA;SP
14885,65473;FACULDADE DE TECNOLOGIA DE JUNDIAÍ;FATEC/JD;SP
14889,52919;FACULDADE DE TECNOLOGIA DE MAUÁ;FATEC MAUÁ;SP
14893,40365;FACULDADE DE TECNOLOGIA DE MOCOCA;FATEC;SP
14897,27811;FACULDADE DE TECNOLOGIA DE SÃO JOSÉ DO RIO PRETO;FATECRP;SP
14901,15256;FACULDADE DE TECNOLOGIA ZONA LESTE;FATEC-ZL;SP
14905,02702;FACULDADE DE ITAPECERICA DA SERRA;FIT;SP
14908,90148;FACULDADE POLITEC;FAP;SP
14912,77594;CENTRO UNIVERSITÁRIO FLUMINENSE;UNIFLU;RJ
14916,6504;FACULDADE DE TECNOLOGIA DE CATALÃO;FATECA;GO
14920,52486;FACULDADE DE TECNOLOGIA INTENSIVA;FATECI;CE
14924,39932;FACULDADE TECNOLOGIA EDUVALE - AVARÉ;FATEC EDUVALE;SP
14928,27378;FACULDADE DE TECNOLOGIA TUPY CURITIBA;FTT-CWB;PR
14932,14823;CENTRO DE EDUCAÇÃO SUPERIOR BARNABITA;CESB;MG
14936,02269;FACULDADE DE CIÊNCIAS GERENCIAIS;;SP
14939,89715;FACULDADE DE TECNOLOGIA FAMA;FAMA;PE
14943,77161;FACULDADE BATISTA DO ESTADO DO RIO DE JANEIRO - FABERJ;FABERJ;RJ
14947,64607;INSTITUTO SUPERIOR DE EDUCAÇÃO DO ICESP;ISE-ICESP;DF
14951,52053;FACULDADE DE TECNOLOGIA DE GRAVATAÍ;FAQI;RS
14955,39499;FACULDADE TECNOLÓGICA INAP;FAT- INAP;MG
14959,26945;FACULDADE DE TECNOLOGIA JARDIM;FATEJ;SP
14963,1439;FACULDADE DE ROSEIRA;FARO;SP
14967,01836;FACULDADE DE TECNOLOGIA PEDRO ROGÉRIO GARCIA;FATTEP;SC
14970,89282;FACULDADE DE TECNOLOGIA DE CURITIBA;FATEC-PR;PR
14974,76728;FACULDADE DE TECNOLOGIA IBRATEC DE JOÃO PESSOA;UNIBRATEC;PB
14978,64174;FACULDADE DE TECNOLOGIA EQUIPE DARWIN;FTED;DF
14982,5162;FACULDADE DE TECNOLOGIA TECBRASIL - UNIDADE PORTO ALEGRE;Ftec Porto Alegre;RS
14986,39066;FACULDADE DE TECNOLOGIA TECBRASIL - UNIDADE BENTO GONÇALVES;Ftec Bento Gonçalves;RS
14990,26512;INSTITUTO FEDERAL DE EDUCAÇÃO, CIÊNCIA E TECNOLOGIA FARROUPILHA;IFFarroupilha;RS
14994,13957;FACULDADE DE TECNOLOGIA SENAI ÍTALO BOLOGNA;FATECIB;GO
14998,01403;FACULDADE DE TECNOLOGIA SENAI DE DESENVOLVIMENTO GERENCIAL;FATESG;GO
15001,88849;ESCOLA SUPERIOR DE ENGENHARIA E GESTÃO DE SÃO PAULO - ESEG;ESEG;SP
15005,76295;FACULDADE DE TECNOLOGIA SENAI PORTO ALEGRE;FATEC SENAI;RS
15009,63741;INSTITUTO CATÓLICO DE ESTUDOS SUPERIORES DO PIAUÍ;ICESPI;PI
15013,51187;FACULDADE DE CERES;FACERES;GO
15017,38633;FACULDADE JOAQUIM NABUCO - PAULISTA;FJN;PE
15021,26079;FACULDADE TOBIAS BARRETO;FTB;SE
15025,13524;FACULDADE JATAIENSE;FAJA;GO
15029,0097;FACULDADE DE CIÊNCIAS SOCIAIS APLICADAS E DE TECNOLOGIAS DE AGUA BOA;FACESA;MT
15032,88416;FACULDADE ANHANGUERA DE SANTA BÁRBARA;;SP
15036,75862;FACULDADE ANHANGUERA DE TAUBATÉ;;SP
15040,63308;FACULDADE DE CIÊNCIAS JURÍDICAS DE ALAGOAS;FCJAL;AL
15044,50754;FACULDADE DE TECNOLOGIA SENAI SÃO JOSÉ;SENAISC;SC
15048,382;FACULDADE DE TECNOLOGIA SENAI ITAJAÍ;FATEC SENAI ITAJAÍ;SC
15052,25646;FACULDADE DE TECNOLOGIA DE PIRACICABA;FATEP;SP
15056,13092;FACULDADE JOAQUIM NABUCO RECIFE;FJN;PE
15060,00537;FACULDADE METROPOLITANA DE RIO DO SUL;FAMESUL;SC
15063,87983;FACULDADE DE TECNOLOGIA SENAC GOIÁS;;GO
15067,75429;CENTRO UNIVERSITÁRIO BARRIGA VERDE;UNIBAVE;SC
15071,62875;CENTRO DE ENSINO SUPERIOR DE UBERABA;CESUBE;MG
15075,50321;FACULDADE NOSSA CIDADE;FNC;SP
15079,37767;FACULDADE DE TECNOLOGIA PAULO FREIRE;FATEP-DF;DF
15083,25213;FACULDADE EVILÁSIO FORMIGA;FEF;PB
15087,12659;FACULDADE NAZARENA DO BRASIL;FNB;SP
15091,00104;FACULDADE PERUIBE;FPBE;SP
15094,8755;FACULDADE ALIANÇA;FACE;PI
15098,74996;FACULDADE MINEIRENSE;FAMA;GO
15102,62442;FACULDADE DE TECNOLOGIA ROGACIONISTA;ROGA;DF
15106,49888;FACULDADE DE COMUNICAÇÃO SOCIAL DE PASSOS;FACOMP;MG
15110,37334;FACULDADE DE ENSINO SUPERIOR DO NORDESTE;FAESNE;PB
15114,2478;FACULDADE DE TECNOLOGIA INED - UNIDADE IPATINGA;FATEC IPATINGA;MG
15118,12226;FACULDADE DE TECNOLOGIA CÉSAR LATTES;;SP
15121,99671;FACULDADE DE DIREITO DE PEDRO LEOPOLDO;FADIPEL;MG
15125,87117;INSTITUTO SUPERIOR DE EDUCAÇÃO PROFESSORA NAIR FORTES ABU-MERHY;ISEFOR;MG
15129,74563;INSTITUTO SUPERIOR DE EDUCAÇÃO DE MATIAS BARBOSA;ISEMB;MG
15133,62009;FACULDADE AÇÃO;FCTVALE;SC
15137,49455;FACULDADE DE TECNOLOGIA INED - UNIDADE LAGOA DA PAMPULHA;FATEC/PITÁGORAS;MG
15141,36901;FACULDADES INTEGRADAS DE CACOAL;UNESC;RO
15145,24347;FACULDADES INTEGRADAS PITÁGORAS;FIP-MOC;MG
15149,11793;INSTITUTO DE FILOSOFIA E TEOLOGIA DE GOIÁS;IFITEG;GO
15152,99238;FACULDADE DE INHUMAS - FAC-MAIS;FACMAIS;GO
15156,86684;FACULDADE DE TECNOLOGIA DE PORTO ALEGRE;FAQI;RS
15160,7413;FACULDADE LITERATUS;FAL;AM
15164,61576;FACULDADE DO VALE ELVIRA DAYRELL - FAVED;FAVED;MG
15168,49022;FACULDADE INTEGRAÇÃO TIETE;FIT;SP
15172,36468;FACULDADE DE TECNOLOGIA SENAC JARAGUÁ DO SUL;;SC
15176,23914;FACULDADE DE TECNOLOGIA SENAI CETIND;;BA
15180,1136;FACULDADE DO CENTRO EDUCACIONAL MINEIRO - FACEM;FACEM-BH;MG
15183,98805;FACULDADE DE TECNOLOGIA AMÉRICA DO SUL;;PR
15187,86251;FACULDADE DE TECNOLOGIA DE PALMAS;FTP;TO
15191,73697;FACULDADE DE CIÊNCIAS SOCIAIS DOS PALMARES;FACIP;PE
15195,61143;FACULDADE DE TECNOLOGIA ÁLVARES DE AZEVEDO;FAATESP;SP
15199,48589;INSTITUTO FEDERAL DE EDUCAÇÃO, CIÊNCIA E TECNOLOGIA DO SUL DE MINAS GERAIS;IF SUL DE MINAS;MG
15203,36035;FACULDADE PITÁGORAS DE BETIM;PITÁGORAS-BETIM;MG
15207,23481;FACULDADE TERRA NORDESTE;FATENE;CE
15211,10927;FACULDADE PADRE ANCHIETA DE CAJAMAR;;SP
15214,98372;FACULDADE DE EDUCAÇÃO FÍSICA DE ARAGUAÍNA;ITPAC;TO
15218,85818;FACULDADES INTEGRADAS DE MINEIROS;FIMES;GO
15222,73264;INSTITUTO SUPERIOR DE EDUCAÇÃO DE GOIANA;I.S.E.G.;PE
15226,6071;FACULDADE DE BALSAS;UNIBALSAS;MA
15230,48156;FACULDADE PANAMERICANA DE JI-PARANÁ;;RO
15234,35602;FACULDADE JK - UNIDADE I - GAMA;;DF
15238,23048;FACULDADE DE ENFERMAGEM DE BELO JARDIM;FAEB;PE
15242,10494;FACULDADES INTEGRADAS BARROS MELO;FIBAM;PE
15245,97939;FACULDADE DE TECNOLOGIA SENAI BELO HORIZONTE;FATEC SENAI BH;MG
15249,85385;FACULDADE PROFESSOR MIGUEL ÂNGELO DA SILVA SANTOS;FEMASS;RJ
15253,72831;FACULDADE UNIGRAN CAPITAL;UNIGRAN CAPITAL;MS
15257,60277;FACULDADE DE ENFERMAGEM NOVA ESPERANÇA DE MOSSORÓ - FACENE/RN;FACENE/RN;RN
15261,47723;FACULDADE SÃO PAULO;FACSP;SP
15265,35169;ESCOLA SUPERIOR PAULISTA DE ADMINISTRAÇÃO - ESPA;ESPA;SP
15269,22615;FACULDADE RIO CLARO;;RS
15273,10061;FACULDADE CIDADE DE GUANHÃES - FACIG;FACIG;MG
15276,97506;FACULDADE METROPOLITANA DA AMAZÔNIA;FAMAZ;PA
15280,84952;FACULDADE METROPOLITANA DE MARABÁ;METROPOLITANA;PA
15284,72398;FACULDADE DOM PEDRO II DE TECNOLOGIA;FAB;BA
15288,59844;FACULDADE PASCHOAL DANTAS;FPD;SP
15292,4729;FACULDADE ANHANGUERA JARAGUÁ DO SUL;FATEJA;SC
15296,34736;FACULDADE DE TECNOLOGIA DO VALE DO IVAÍ;FATEC-IVAI;PR
15300,22182;FACULDADES INTEGRADAS CAMPO-GRANDENSES;FIC;RJ
15304,09628;UNIVERSIDADE FEDERAL DO RECÔNCAVO DA BAHIA;UFRB;BA
15307,97074;FUNDAÇÃO UNIVERSIDADE FEDERAL DA GRANDE DOURADOS;UFGD;MS
15311,84519;FACULDADE REGIONAL PALMITOS;FAP;SC
15315,71965;CENTRO UNIVERSITÁRIO CATÓLICO SALESIANO AUXILIUM;UNISALESIANO;SP
15319,59411;FACULDADE INTEGRADA TIRADENTES;FITS;AL
15323,46857;FACULDADE ADVENTISTA DA BAHIA;FADBA;BA
15327,34303;FACULDADE DE TECNOLOGIA SENAI CAMPO GRANDE;;MS
15331,21749;FACULDADE SÃO FRANCISCO DA PARAÍBA;FASP;PB
15335,09195;FACULDADE DE TECNOLOGIA HERRERO;FATEC;PR
15338,96641;FACULDADE PARQUE;FAP;BA
15342,84086;FACULDADE DE EXCELÊNCIA EDUCACIONAL DO RIO GRANDE DO NORTE;SUDERN;RN
15346,71532;FACULDADE CENTRO MATO-GROSSENSE;;MT
15350,58978;FACULDADE DE TECNOLOGIA MACHADO DE ASSIS;FAMA;PR
15354,46424;FACULDADE DO NORTE GOIANO;FNG;GO
15358,3387;FACULDADE APOGEU;APOGEU;DF
15362,21316;FACULDADE DE TECNOLOGIA FATEP;FATEP;SP
15366,08762;FACULDADE DE OURO PRETO DO OESTE;UNEOURO;RO
15369,96208;FACULDADE CATÓLICA DE RONDONIA;FCR;RO
15373,83653;FACULDADE DE ADMINISTRAÇÃO E NEGÓCIOS EM RIBEIRÃO PRETO;;SP
15377,71099;FACULDADE DE CIÊNCIAS GERENCIAIS EM VOTUPORANGA;;SP
15381,58545;FACULDADE DE CIÊNCIAS GERENCIAIS BARÃO DE JUNDIAÍ;FCG;SP
15385,45991;FACULDADE DE ENSINO SUPERIOR KM 126;;PR
15389,33437;FACULDADE DE TECNOLOGIA ASSESSORITEC;;SC
15393,20883;FACULDADE DE EDUCAÇÃO E MEIO AMBIENTE;FAEMA;RO
15397,08329;FACULDADE ANHANGUERA DE CAXIAS DO SUL;FACS;RS
15400,95775;FACULDADE DE TECNOLOGIA FUNDETEC;FATEF;SP
15404,8322;FACULDADE DE TECNOLOGIA TECMED;TECMED;SP
15408,70666;FACULDADE ANGLO-AMERICANO DE JOÃO PESSOA;FAAJP;PB
15412,58112;FACULDADE ANGLO-AMERICANO DE CAXIAS DO SUL;FAACS;RS
15416,45558;FACULDADE ANGLO-AMERICANO DE PASSO FUNDO;FAAPF;RS
15420,33004;FACULDADE ANHANGÜERA DE SÃO JOSÉ;;SP
15424,2045;FACULDADE ANHANGÜERA DE SOROCABA;FSO;SP
15428,07896;FACULDADE ANHANGÜERA DE PIRACICABA;;SP
15431,95342;FACULDADE DE AGRONEGÓCIO PARAÍSO DO NORTE;FAPAN;PR
15435,82787;FACULDADE RIO SONO;RISO;TO
15439,70233;FACULDADE DELTA;FACULDADE DELTA;GO
15443,57679;FACULDADE PORTO DAS ÁGUAS;FAPAG;SC
15447,45125;FACULDADE CENTRO PAULISTANO;;SP
15451,32571;FACULDADE DE TECNOLOGIA DE NOVA ANDRADINA;;MS
15455,20017;FACULDADE NOROESTE;-;GO
15459,07463;FACULDADE NOVA ROMA;FNR;PE
15462,94909;FACULDADE DE TECNOLOGIA GESTÃO & MARKETING;IBGM / FGM;PE
15466,82354;FACULDADE ALTERNATIVA DE ENSINO SUPERIOR DO AGRESTE - FAESA;;AL
15470,698;ESCOLA DOMINICANA DE TEOLOGIA;;SP
15474,57246;FACULDADES INTEGRADAS VIANNA JÚNIOR;FIVJ;MG
15478,44692;FACULDADE DE CIÊNCIAS HUMANAS DE CRUZEIRO;FACIC;SP
15482,32138;FACULDADE DE TECNOLOGIA EGÍDIO JOSÉ DA SILVA;FATEGIDIO;MG
15486,19584;FACULDADE CENECISTA DE RIO BONITO;FACERB;RJ
15490,0703;FACULDADE MESSIANICA;;SP
15493,94476;FACULDADE DE TECNOLOGIA SENAC DF;FAC SENAC DF;DF
15497,81921;FACULDADE PRESBITERIANA AUGUSTO GALVÃO;FAPAG;BA
15501,69367;FACULDADE DE PATROCINIO;IESP;MG
15505,56813;FACULDADE SANTA EMÍLIA;;PE
15509,44259;FACULDADE CATÓLICA DO CARIRI;;CE
15513,31705;FACULDADE REGIONAL DE RIACHÃO DO JACUÍPE;FARJ;BA
15517,19151;FACULDADE DE TECNOLOGIA DE SANTA CATARINA;FATESC;SC
15521,06597;FACULDADE DE TECNOLOGIA E CIENCIAS DO NORTE DO PARANÁ;FATECIE;PR
15524,94043;CENTRO UNIVERSITÁRIO MUNICIPAL DE SÃO JOSÉ;USJ;SC
15528,81488;FACULDADE DE TECNOLOGIA ALFA DE UMUARAMA;;PR
15532,68934;FACULDADE UNA DE CONTAGEM;FUNAC;MG
15536,5638;FACULDADE BI MINAS;FACULDADE IBS;MG
15540,43826;FACULDADE KENNEDY DE BELO HORIZONTE;FKBH;MG
15544,31272;FACISA-UNAI FACULDADE DE CIÊNCIAS DA SAÚDE DE UNAÍ;FACISA-UNAI;MG
15548,18718;FACULDADE DE TECNOLOGIA CDL DE FORTALEZA;;CE
15552,06164;INSTITUTO FEDERAL DE EDUCAÇÃO CIÊNCIA E TECNOLOGIA DE RONDÔNIA;IFRO;RO
15555,9361;INSTITUTO FEDERAL DE EDUCAÇÃO, CIÊNCIA E TECNOLOGIA DO TOCANTINS;IFTO;TO
15559,81055;FACULDADE DE TECNOLOGIA CENTEC - CARIRI;CENTEC;CE
15563,68501;FACULDADES INTEGRADAS DE ITARARÉ;FAFIT-FACIC;SP
15567,55947;FACULDADE ANTÔNIO MENEGHETTI;AMF;RS
15571,43393;FACULDADE DE TECNOLOGIA SENAI FELIX GUISARD;;SP
15575,30839;FACULDADE DE TECNOLOGIA SENAI NADIR DIAS DE FIGUEIREDO;;SP
15579,18285;FACULDADE DE TECNOLOGIA SENAI ANCHIETA;;SP
15583,05731;FACULDADE DE TECNOLOGIA SENAI MARIANO FERRAZ;;SP
15586,93177;FACULDADE DE TECNOLOGIA SENAI ANTÔNIO ADOLPHO LOBBE;;SP
15590,80623;FACULDADE DE CIÊNCIAS GERENCIAIS E EMPREENDEDORISMO - FACIGE;FACIGE;MG
15594,68068;FACULDADE DE TECNOLOGIA EVOLUÇÃO;FECET;CE
15598,55514;FACULDADE ANHANGÜERA DE CAMPINAS;;SP
15602,4296;ESCOLA SUPERIOR DE ARTES CÉLIA HELENA;;SP
15606,30406;FACULDADE DE EDUCAÇÃO  ACREANO EUCLIDES DA CUNHA;INEC;AC
15610,17852;FACULDADE VÉRTICE;VÉRTICE;MG
15614,05298;FACULDADE DIOCESANA DE MOSSORÓ;;RN
15617,92744;FACULDADE DE CIÊNCIAS HUMANAS, ECONÔMICAS E DA SAÚDE DE ARAGUAÍNA;FAHESA / ITPAC;TO
15621,8019;ESCOLA SUPERIOR DE SAÚDE DE ARCOVERDE;ESSA;PE
15625,67635;FACULDADE PITÁGORAS DE POÇOS DE CALDAS;;MG
15629,55081;FACULDADE PITÁGORAS DE SÃO LUIZ;;MA
15633,42527;FACULDADE PITÁGORAS DE GUARAPARI;;ES
15637,29973;FACULDADE DE TECNOLOGIA PITÁGORAS - UNIDADE LONDRINA;;PR
15641,17419;FACULDADE DE TECNOLOGIA DE TAUBATÉ;ETEP;SP
15645,04865;FACULDADE ANHANGUERA DE ITAPECERICA DA SERRA;;SP
15648,92311;FACULDADE DE CONCHAS;;SP
15652,79757;FACULDADE DE CIÊNCIAS MÉDICAS DA BAHIA;CIENCIAS MEDICAS;BA
15656,67202;FACULDADE FASIPE;FASIPE;MT
15660,54648;FACULDADE BATISTA PIONEIRA;;RS
15664,42094;FACULDADE DO TRABALHO;FATRA;MG
15668,2954;FACULDADE DE CASTANHAL;FCAT;PA
15672,16986;ESCOLA SUPERIOR DE ADMINISTRAÇÃO, MARKETING E COMUNICAÇÃO DE PIRACICABA;ESAMC PIRACICABA;SP
15676,04432;FACULDADE INTEGRADA DAS CATARATAS;;PR
15679,91878;FUNDAÇÃO UNIVERSIDADE FEDERAL DO ABC;UFABC;SP
15683,79324;FACULDADE DE TECNOLOGIA DE PRAIA GRANDE;FATECPG;SP
15687,66769;FACULDADE CLARETIANA DE TEOLOGIA;;PR
15691,54215;ESCOLA SUPERIOR DE ADMINISTRAÇÃO E GESTÃO DA BAIXADA SANTISTA;ESAGS BS;SP
15695,41661;FACULDADE INTERNACIONAL DO DELTA;INTA;PI
15699,29107;FACULDADE AUM;;MT
15703,16553;FACULDADE PITÁGORAS DE FEIRA DE SANTANA;;BA
15707,03999;FACULDADE INTEGRADA DE ARAGUATINS;FAIARA;TO
15710,91445;CENTRO UNIVERSITÁRIO DE SETE LAGOAS;UNIFEMM;MG
15714,78891;FACULDADE DE CIÊNCIAS E TECNOLOGIA DO MARANHÃO;FACEMA;MA
15718,66336;FACULDADE ITOP;ITOP;TO
15722,53782;FACULDADE METROPOLITANA DO PLANALTO NORTE;FAMEPLAN;SC
15726,41228;FACULDADE DE SÃO JOSÉ DOS CAMPOS;BILAC;SP
15730,28674;FACULDADE DE TECNOLOGIA CENTEC - SERTÃO CENTRAL;FTC SERTÃO CENTRAL;CE
15734,1612;FACULDADE CRUZ AZUL;FACRAZ;SP
15738,03566;FACULDADE DE TECNOLOGIA INESUL DO PARANÁ;FIPAR;PR
15741,91012;FACULDADE ESTAÇÃO;FAEST;PR
15745,78458;FACULDADE DO MÉDIO PARNAÍBA;;PI
15749,65903;CENTRO UNIVERSITÁRIO ESTADUAL DA ZONA OESTE;UEZO;RJ
15753,53349;INSTITUTO SUPERIOR DE TECNOLOGIA EM CIÊNCIAS DA COMPUTAÇÃO DO RIO DE JANEIRO;IST-RIO;RJ
15757,40795;INSTITUTO SUPERIOR DE TECNOLOGIA EM CIÊNCIA DA COMPUTAÇÃO DE PETRÓPOLIS;ISTCCP;RJ
15761,28241;INSTITUTO SUPERIOR DE EDUCAÇÃO PROFESSOR ALDO MUYLAERT;ISEPAM;RJ
15765,15687;INSTITUTO SUPERIOR DE EDUCAÇÃO DE SANTO ANTÔNIO DE PÁDUA;ISE PÁDUA;RJ
15769,03133;INSTITUTO SUPERIOR DE EDUCAÇÃO DE ITAPERUNA;ISEI;RJ
15772,90579;FACULDADE SANTO AUGUSTO;FAISA;RS
15776,78025;FACULDADE DE EDUCAÇÃO SÃO BRAZ;;PR
15780,6547;INSTITUTO FEDERAL DE EDUCAÇÃO, CIÊNCIA E TECNOLOGIA CATARINENSE;IF Catarinense;SC
15784,52916;FACULDADE DE CIÊNCIAS SOCIAIS APLICADAS DE MARABÁ;FACIMAB;PA
15788,40362;FACULDADE DE DIREITO DE GARANHUNS;FDG;PE
15792,27808;FACULDADE DE TECNOLOGIA PAULISTA;;SP
15796,15254;FACULDADE POLIS DAS ARTES;;SP
15800,027;FACULDADE DE TEOLOGIA DE SÃO PAULO DA IGREJA PRESBITERIANA INDEPENDENTE DO BRASIL;;SP
15803,90146;INSTITUTO SUPERIOR DE EDUCAÇÃO BOM JESUS DO ITABAPOANA;ISEBJI;RJ
15807,77592;INSTITUTO SUPERIOR DE EDUCAÇÃO TRÊS RIOS;ISE TRÊS RIOS;RJ
15811,65037;Instituto Superior de Tecnologia de Paracambi;IST PARACAMBI;RJ
15815,52483;FACULDADE DE TECNOLOGIA INED - UNIDADE CONTAGEM;;MG
15819,39929;UNIVERSIDADE ESTADUAL DE RORAIMA;UERR;RR
15823,27375;FACULDADE EDUCACIONAL DE MATELÂNDIA;FAMA;PR
15827,14821;FACULDADE DE TECNOLOGIA DE SÃO BERNARDO DO CAMPO;FATEC-SB;SP
15831,02267;FACULDADE INTERNACIONAL SIGNORELLI;;RJ
15834,89713;FACULDADE SOGIPA DE EDUCAÇÃO FÍSICA;;RS
15838,77159;FACULDADE FACMIL;;SP
15842,64605;FACULDADE DE TECNOLOGIA SENAC CAÇADOR;SENAC;SC
15846,5205;FACULDADE DE TECNOLOGIA SENAC SÃO MIGUEL DO OESTE;5133;SC
15850,39496;FACULDADE DINÂMICA;;PR
15854,26942;FACULDADES INTEGRADAS PADRE ALBINO;FIPA;SP
15858,14388;FACULDADE UIRAPURU;FAU;SP
15862,01834;FACULDADES INTEGRADAS PAULISTA;FIP;SP
15865,8928;FACULDADE RAIMUNDO MARINHO;FRM;AL
15869,76726;UNIVERSIDADE ESTADUAL DE ALAGOAS - UNEAL;UNEAL;AL
15873,64172;FACULDADE DE CIÊNCIAS JURÍDICAS DE SANTOS DUMONT;FCJSD;MG
15877,51617;FACULDADE DE DIREITO DE CARANGOLA;FDC;MG
15881,39063;FACULDADE FORTIUM;;DF
15885,26509;FACULDADES INTEGRADAS DE TAQUARA;FACCAT;RS
15889,13955;FACULDADE ANHANGÜERA DE RIBEIRÃO PRETO;;SP
15893,01401;FACULDADE DE CIÊNCIAS E TECNOLOGIA DE BRASÍLIA;FACITEB;DF
15896,88847;FACULDADE ANHANGÜERA DE DOURADOS;FAD;MS
15900,76293;FACULDADE DE CIÊNCIAS SOCIAIS APLICADAS E HUMANAS DE GARANHUNS;FAHUG;PE
15904,63739;FACULDADES ATIBAIA;FAAT;SP
15908,51184;FACULDADES UNIFICADAS DOCTUM DE CATAGUASES;FACULDADES DOCTUM;MG
15912,3863;FACULDADES UNIFICADAS DOCTUM DE GUARAPARI;FACULDADES DOCTUM;ES
15916,26076;FACULDADES UNIFICADAS DOCTUM DE IÚNA;FACULDADES DOCTUM;ES
15920,13522;FACULDADES UNIFICADAS DOCTUM DE LEOPOLDINA;FACULDADES DOCTUM;MG
15924,00968;FACULDADE PORTO-ALEGRENSE;FAPA;RS
15927,88414;FACULDADE GUILHERME GUIMBALA;FGG;SC
15931,7586;FUNDAÇÃO UNIVERSIDADE FEDERAL DO PAMPA - UNIPAMPA;UNIPAMPA;RS
15935,63306;FACULDADE SERIGY;FASERGY;SE
15939,50751;FACULDADES INTEGRADAS ASMEC;ASMEC;MG
15943,38197;FACULDADES UNIFICADAS DOCTUM DE TEÓFILO OTONI;FACULDADES DOCTUM;MG
15947,25643;FACULDADE IMPACTA DE TECNOLOGIA;FIT;SP
15951,13089;FACULDADES UNIVERSITAS;;SP
15955,00535;INSTITUTO DE ENSINO SUPERIOR INTEGRADO-IESI;FENORD;MG
15958,87981;FACULDADES OPET;;PR
15962,75427;FACULDADE DE TECNOLOGIA DE MINAS GERAIS - FATEMIG;;MG
15966,62873;FACULDADES INTEGRADAS DA UNIÃO EDUCACIONAL DO PLANALTO CENTRAL - FACIPLAC;FACIPLAC;DF
15970,50318;FACULDADE PARA O DESENVOLVIMENTO DO SUDESTE TOCANTINENSE;FADES;TO
15974,37764;FACULDADE ANHANGÜERA DE BAURU;;SP
15978,2521;FACULDADE DE CIÊNCIA, TECNOLOGIA E EDUCAÇÃO;FACITE;BA
15982,12656;FACULDADE CAMPO REAL;CAMPO REAL;PR
15986,00102;FACULDADE GUARAPUAVA;FG;PR
15989,87548;FACULDADE CATHEDRAL;FACES;RR
15993,74994;FACULDADES VALE DO CARANGOLA - FAVALE;FAVALE;MG
15997,6244;FACULDADE PRESIDENTE ANTÔNIO CARLOS;FAPAC;TO
16001,49885;FACULDADE ANHANGUERA DE ANÁPOLIS;FAAA;GO
16005,37331;FACULDADE ANHANGUERA DE JACAREÍ;;SP
16009,24777;FACULDADES INTEGRADAS DO NORTE DE MINAS - FUNORTE;FUNORTE;MG
16013,12223;FACULDADE ADVENTISTA DE HORTOLÂNDIA;;SP
16016,99669;LIBERTAS - FACULDADES INTEGRADAS;LIBERTAS;MG
16020,87115;FACULDADES INTEGRADAS SÃO JUDAS TADEU;SJT;RS
16024,74561;FACULDADE DE TECNOLOGIA DE PRESIDENTE PRUDENTE;FATEC;SP
16028,62007;FACULDADE DE TECNOLOGIA DE BRAGANÇA PAULISTA;;SP
16032,49452;FACULDADE DE VARGEM GRANDE PAULISTA;;SP
16036,36898;FACULDADE DE CIÊNCIAS HUMANAS E SOCIAIS DE ARARIPINA - FACISA;FACISA;PE
16040,24344;FACULDADE ANHANGUERA DE JOINVILLE;;SC
16044,1179;FACULDADE DE TECNOLOGIA DE SÃO JOSÉ DOS CAMPOS;ETEP;SP
16047,99236;FACULDADES UNIDAS DO VALE DO ARAGUAIA;UNIVAR;MT
16051,86682;CENTRO UNIVERSITÁRIO SÃO JOSÉ DE ITAPERUNA;;RJ
16055,74128;UNIVERSIDADE DO ESTADO DO AMAPÁ;UEAP;AP
16059,61574;FACULDADE MUNICIPAL DE PALHOÇA;FMP;SC
16063,49019;FAMAC - FACULDADE DE MACHADINHO DO OESTE;FAMAC;RO
16067,36465;FACULDADE OBOÉ - FACO;FACO;CE
16071,23911;INSTITUTO LOGOS DE EDUCAÇÃO SUPERIOR;ILES;AL
16075,11357;FACULDADE DE TECNOLOGIA DE VALENÇA;FACTIVA;BA
16078,98803;FACULDADE DE TECNOLOGIA DE ENSINO SUPERIOR - FATEC;CENTES;MG
16082,86249;FACULDADE DE TEOLOGIA E CIÊNCIAS HUMANAS;ITEPAFACULDADES;RS
16086,73695;FACULDADE DE TECNOLOGIA BANDEIRANTES;BANDTEC;SP
16090,61141;INSTITUTO SÃO PAULO DE ESTUDOS SUPERIORES;ITESP;SP
16094,48586;FACULDADE HSM;;SP
16098,36032;FACULDADE LÍDER;FAL;PE
16102,23478;FACULDADE NORTE CAPIXABA DE SAO MATEUS;;ES
16106,10924;FACULDADE UNIÃO ARARUAMA DE ENSINO S/S Ltda.;FAC-UNILAGOS;RJ
16109,9837;FACULDADE CENTRO OESTE;FACEOPAR;PR
16113,85816;ESCOLA SUPERIOR NACIONAL DE SEGUROS - UNIDADE SÃO PAULO;ESNS-SP;SP
16117,73262;FACULDADE ANHANGUERA DE SUMARÉ;FACSUMARÉ;SP
16121,60708;FACULDADE DE TECNOLOGIA ALTO MÉDIO SÃO FRANCISCO;FAC FUNAM;MG
16125,48154;FACULDADE ESPECIALIZADA NA ÁREA DE SAÚDE DO RIO GRANDE DO SUL;FASURGS;RS
16129,35599;FACULDADE METROPOLITANA DE ANÁPOLIS;FAMA;GO
16133,23045;FACULDADE DE TECNOLOGIA DA SERRA GAÚCHA - CAXIAS DO SUL;FTSG;RS
16137,10491;FACULDADE DE TECNOLOGIA DE MACAPÁ;FTA;AP
16140,97937;FACULDADE ANGLO-AMERICANO DE CHAPECÓ;FAACH;SC
16144,85383;FACULDADE DE EDUCAÇÃO E CULTURA DE VILHENA;FAEV;RO
16148,72829;FACULDADE PITÁGORAS DE VOTORANTIM - SOROCABA;-;SP
16152,60275;FACULDADE DE TECNOLOGIA INED - UNIDADE BETIM;FATECBETIM;MG
16156,47721;FACULDADE PAULO SETUBAL;FPS;SP
16160,35166;FACULDADE DE TECNOLOGIA DO ISTITUTO EUROPEO DI DESIGN;IED SP;SP
16164,22612;FACULDADE DO POVO;FAP;SP
16168,10058;FACULDADE DE TECNOLOGIA INSPIRAR;Inspirar;PR
16171,97504;FACULDADE EVOLUÇÃO ALTO OESTE POTIGUAR;FACEP;RN
16175,8495;INSTITUTO NACIONAL DE ENSINO SUPERIOR E PÓS-GRADUAÇÃO PADRE GERVÁSIO;INAPÓS;MG
16179,72396;FACULDADE DE CIÊNCIAS APLICADAS E TECNOLÓGICAS DO LITORAL SUL;FACSUL;SP
16183,59842;FACULDADE EVANGÉLICA DE TAGUATINGA;FE TAGUATINGA;DF
16187,47288;FACULDADE DO SERTÃO BAIANO;FASBE;BA
16191,34733;FACULDADE DE TECNOLOGIA INED - UNIDADE VENDA NOVA;;MG
16195,22179;FACULDADE PRISMA;FAP;MG
16199,09625;ESCOLA DE DIREITO DE BRASÍLIA;EDB;DF
16202,97071;FACULDADE PADRE ANCHIETA DE VÁRZEA PAULISTA;ANCHIETA;SP
16206,84517;FACULDADE DE TECNOLOGIA LA SALLE - ESTRELA;FACSALLE;RS
16210,71963;FACULDADE METROPOLITANA SÃO CARLOS;FAMESC;RJ
16214,59409;FACULDADE METROPOLITANA SÃO CARLOS BJI;FAMESC-BJI;RJ
16218,46855;FACULDADE MOGIANA DO ESTADO DE SÃO PAULO;FAMOESP;SP
16222,343;FACULDADE DE TECNOLOGIA DA SERRA GAÚCHA - BENTO CONÇALVES;FTSG;RS
16226,21746;FACULDADE BRASILEIRA DE ESTUDOS AVANÇADOS;FABEA;MA
16230,09192;FACULDADE DE MÚSICA SOUZA LIMA;FMSL;SP
16233,96638;FACULDADE DE TECNOLOGIA DE SETE LAGOAS;FASSETE;MG
16237,84084;ESCOLA SUPERIOR DE AVIAÇÃO CIVIL;ESAC;PB
16241,7153;FACULDADE DE TECNOLOGIA FINACI;FINACI;SP
16245,58976;FACULDADE DE EDUCAÇÃO, TECNOLOGIA E ADMINISTRAÇÃO DE CAARAPÓ;FETAC;MS
16249,46422;FACULDADES UNIDAS DE PESQUISA, CIÊNCIAS E SAÚDE LTDA;FAPEC;BA
16253,33867;FACULDADE TEOLÓGICA DA ASSEMBLÉIA DE DEUS EM CURITIBA;FATADC;PR
16257,21313;FACULDADE UNIÃO DE CAMPO MOURÃO;;PR
16261,08759;FACULDADE DE TECNOLOGIA TECBRASIL - UNIDADE NOVO HAMBURGO;Ftec Novo Hamburgo;RS
16264,96205;FACULDADE IBMEC DISTRITO FEDERAL;IBMEC/DF;DF
16268,83651;FACULDADE EDUCACIONAL DE FRANCISCO BELTRÃO;FEFB;PR
16272,71097;IPOG - INSTITUTO DE PÓS-GRADUAÇÃO & GRADUAÇÃO;IPOG;GO
16276,58543;FACULDADE DE TECNOLOGIA LOURENÇO FILHO;FATEC - FLF;CE
