id;name;acronym;state
29484,61537;FACULDADE DE CIÊNCIAS JURÍDICAS E SOCIAIS DE MACEIÓ;FAMA;AL
29488,48983;FACULDADE DO AMAZONAS;IAES;AM
29492,36428;FACULDADE HÉLIO ROCHA;FHR;BA
29496,23874;FACULDADE DE CIÊNCIAS HUMANAS E SOCIAIS;FACULDADE AGES;BA
29500,1132;FACULDADE SOCIAL DA BAHIA;FSBA;BA
29503,98766;FACULDADE DE TECNOLOGIA E CIÊNCIAS DE ITABUNA;FTC;BA
29507,86212;FACULDADE ANÍSIO TEIXEIRA DE FEIRA DE SANTANA;FAT;BA
29511,73658;FACULDADE UNIME DE EDUCAÇÃO E COMUNICAÇÃO;FEC;BA
29515,61104;FACULDADE DE TECNOLOGIA E CIÊNCIAS DE JEQUIÉ;FTC;BA
29519,4855;FACULDADE DE EDUCAÇÃO CIÊNCIAS E LETRAS DE PARAÍSO;FECIPAR;TO
29523,35996;FACULDADE DE ENSINO E CULTURA DO CEARÁ;FAECE;CE
29527,23441;FACULDADE J. SIMÕES ENSINO SUPERIOR;FABAVI;ES
29531,10887;FACULDADE DE EDUCAÇÃO;ISECUB;ES
29534,98333;FACULDADE DE GUAÇUÍ;UVV GUAÇUÍ;ES
29538,85779;FACULDADE CENECISTA DE SETE LAGOAS;FCSL;MG
29542,73225;INSTITUTO DE ENSINO SUPERIOR DE TERESINA;IEST;PI
29546,60671;FACULDADE EDUCACIONAL DE DOIS VIZINHOS;FAED;PR
29550,48117;FACULDADE INTEGRADA DA GRANDE FORTALEZA;FGF;CE
29554,35563;FACULDADE ESTÁCIO DE SÁ DE OURINHOS;FAESO;SP
29558,23008;FACULDADE DE CIÊNCIAS SOCIAIS E TECNOLÓGICAS FACITEC;FACITEC;DF
29562,10454;FACULDADE DE ADMINISTRAÇÃO ESCOLA SUPERIOR PROFESSOR PAULO MARTINS;ESPAM;DF
29565,979;FACULDADE CAPIXABA DE ADMINISTRAÇÃO E EDUCAÇÃO;UNICES;ES
29569,85346;FACULDADE ARAGUAIA;FARA;GO
29573,72792;FACULDADE DA SAÚDE E ECOLOGIA HUMANA;FASEH;MG
29577,60238;FACULDADE KENNEDY;FK;MG
29581,47684;FACULDADE NOVOS HORIZONTES;NOVOS HORIZONTES;MG
29585,3513;FACULDADE DE NEGÓCIOS DE BELO HORIZONTE;;MG
29589,22575;INSTITUTO METROPOLITANO DE ENSINO SUPERIOR;IMES;MG
29593,10021;FACULDADE ASA DE BRUMADINHO;IECEMB - FAB;MG
29596,97467;INSTITUTO ESPERANÇA DE ENSINO SUPERIOR;IESPES;PA
29600,84913;INSTITUTO SALESIANO DE FILOSOFIA;INSAF;PE
29604,72359;FACULDADE METROPOLITANA DA GRANDE RECIFE;UNESJ;PE
29608,59805;FACULDADE SÃO MIGUEL;FACULDADE SÃO MIGUEL;PE
29612,47251;FACULDADE DE ENSINO SUPERIOR DO PIAUÍ;FAESPI;PI
29616,34697;FACULDADE DE CIÊNCIAS DE WENCESLAU BRAZ;FACIBRA;PR
29620,22142;FACULDADE DE CAMPINA GRANDE DO SUL;FACSUL;PR
29624,09588;FACULDADE DE CIÊNCIAS E TECNOLOGIA MATER CHRISTI;MATER CHRISTI;RN
29627,97034;FACULDADE DE CIÊNCIAS SOCIAIS APLICADAS IBMEC;FACULDADES IBMEC;RJ
29631,8448;FACULDADE SALESIANA MARIA AUXILIADORA;FSMA;RJ
29635,71926;FACULDADE PIAUIENSE;FAP;PI
29639,59372;FACULDADE BARDDAL DE CIÊNCIAS CONTÁBEIS;FB-CC;SC
29643,46818;FACULDADE BARDDAL DE ARTES APLICADAS;FB-AA;SC
29647,34264;FACULDADE SANTA IZILDINHA;FIESI;SP
29651,21709;FACULDADE DE SÃO VICENTE;FSV;SP
29655,09155;FACULDADE PRÁXIS;FIPEP;SP
29658,96601;ESCOLA SUPERIOR DE TECNOLOGIA E EDUCAÇÃO DE PORTO FERREIRA;ESPF;SP
29662,84047;FACULDADE ITANHAÉM;FAITA;SP
29666,71493;ESCOLA SUPERIOR DE CRICIÚMA - ESUCRI;ESUCRI;SC
29670,58939;FACULDADE DE EDUCAÇÃO DE BOM DESPACHO;FACEB;MG
29674,46385;FACULDADE CENTRAL DE CRISTALINA;FACEC;GO
29678,33831;FACULDADE ESCRITOR OSMAN DA COSTA LINS;FACOL;PE
29682,21276;FACULDADE DE EDUCAÇÃO DE JARU;UNICENTRO;RO
29686,08722;FACULDADE PROMOVE DE SETE LAGOAS;FSLMG;MG
29689,96168;FACULDADE MACHADO DE ASSIS;FAMA;RJ
29693,83614;FACULDADE ATUAL DA AMAZÔNIA;FAA;RR
29697,7106;INSTITUTO DE ENSINO SUPERIOR DE RIO VERDE;IESRIVER;GO
29701,58506;FACULDADE DE INFORMÁTICA DO RECIFE;FACIR;PE
29705,45952;FACULDADE DE CIÊNCIAS CONTÁBEIS DE RECIFE;FACCOR;PE
29709,33398;INSTITUTO PERNAMBUCANO DE ENSINO SUPERIOR;IPESU;PE
29713,20843;FACULDADE INTEGRADA DE PERNAMBUCO;FACIPE;PE
29717,08289;FACULDADE DE NEGÓCIOS E TECNOLOGIAS DA INFORMAÇÃO;FACNET;DF
29720,95735;FACULDADE DE PRESIDENTE PRUDENTE;FAPEPE;SP
29724,83181;FACULDADE DE CIÊNCIAS E TECNOLOGIA DE TERESINA;FACET;PI
29728,70627;FACULDADE DE TECNOLOGIA DE SÃO VICENTE;FATEF;SP
29732,58073;ESCOLA SUPERIOR DE GESTÃO COMERCIAL E MARKETING;ESIC;PR
29736,45519;FACULDADE DO SUL DA BAHIA;FASB;BA
29740,32965;FACULDADE UNIÃO DAS AMÉRICAS;;PR
29744,2041;FACULDADE DE IMPERATRIZ;FACIMP;MA
29748,07856;FACULDADE NOBRE DE FEIRA DE SANTANA;FAN;BA
29751,95302;FACULDADE DE VIÇOSA;FDV;MG
29755,82748;FACULDADE DE PORTO VELHO;FIP;RO
29759,70194;ESCOLA SUPERIOR DE ADMINISTRAÇÃO E GESTÃO;ESAGS;SP
29763,5764;FACULDADE DE GUARARAPES;FAG;SP
29767,45086;FACULDADE XV DE AGOSTO;FAQ;SP
29771,32532;FACULDADE SANTA AMÉLIA;SECAL;PR
29775,19978;FACULDADE DE CARIACICA;FAC DE CARIACICA;ES
29779,07423;FACULDADE INTERAMERICANA DE PORTO VELHO;UNIRON;RO
29782,94869;FACULDADE DE CIÊNCIAS SOCIAIS APLICADAS;FCSA;MT
29786,82315;FACULDADE GENNARI E PEARTREE;FGP;SP
29790,69761;FACULDADE DE ENSINO SUPERIOR DE MARECHAL CÂNDIDO RONDON;ISEPE  RONDON;PR
29794,57207;FACULDADE INTEGRAL DIFERENCIAL;FACID;PI
29798,44653;FACULDADE DE CIÊNCIAS APLICADAS DOUTOR LEÃO SAMPAIO;FLS;CE
29802,32099;INSTITUTO SUPERIOR DE EDUCAÇÃO LA SALLE - ISE La Salle/RJ;ISE LA SALLE/RJ;RJ
29806,19545;INSTITUTO LUTERANO DE ENSINO SUPERIOR DE PORTO VELHO;ULBRA ILES;RO
29810,0699;IMP de Ensino Superior - IMP;IMP;DF
29813,94436;FACULDADE DE TECNOLOGIA INTERAMÉRICA;INTERAMERICA;SP
29817,81882;FACULDADE DE TECNOLOGIA CARLOS DRUMMOND DE ANDRADE;CSET DRUMMOND;SP
29821,69328;FACULDADE DE TECNOLOGIA OSWALDO CRUZ;FATEC OSWALDO CRUZ;SP
29825,56774;FACULDADE LUSO-BRASILEIRA;FALUB;PE
29829,4422;UNIDADE DE ENSINO SUPERIOR EXPOENTE;UNIEXP;PR
29833,31666;FACULDADE AUTÔNOMA DE DIREITO;FADISP;SP
29837,19112;FACULDADE DE ENFERMAGEM NOVA ESPERANÇA;FACENE;PB
29841,06557;FACULDADE ASSOCIADA BRASIL;FAB;SP
29844,94003;FACULDADE INDEPENDENTE DO NORDESTE;FAINOR;BA
29848,81449;FACULDADE PADRE JOÃO BAGOZZI;FACULDADE BAGOZZI;PR
29852,68895;FACULDADE DE TECNOLOGIA E NEGÓCIOS CARLOS DRUMMOND DE ANDRADE;FTNCDA;SP
29856,56341;FACULDADE DE TECNOLOGIA SENAI CHAPECÓ;SENAI;SC
29860,43787;FACULDADE DE EDUCAÇÃO REGIONAL SERRANA;FUNPAC;ES
29864,31233;FACULDADE DE JOSÉ BONIFÁCIO;FJB;SP
29868,18679;FACULDADE ESPÍRITO SANTENSE;UNICAPE;ES
29872,06124;FACULDADE DE CIÊNCIAS SOCIAIS APLICADAS;FACSA;MT
29875,9357;FACULDADE REGIONAL SERRANA;FUNPAC;ES
29879,81016;FACULDADE SANTA MARIA;FSM;PE
29883,68462;FACULDADE NORDESTE;FANOR;CE
29887,55908;FACULDADE DE ITAPIRANGA;SEI/FAI;SC
29891,43354;FACULDADE EDUCACIONAL DE PONTA GROSSA;UNIÃO;PR
29895,308;FACULDADE DO VALE DO IPOJUCA;FAVIP;PE
29899,18246;FACULDADE DE TECNOLOGIA PROF. LUIZ ROSA;FATEC PROF LUIZ ROSA;SP
29903,05691;FACULDADE METROPOLITANA DE GUARAMIRIM;FAMEG;SC
29906,93137;FACULDADE AIEC;AIEC / FAAB;DF
29910,80583;FACULDADE HORIZONTINA;FAHOR;RS
29914,68029;FACULDADE INTESP;INTESP;SP
29918,55475;FACULDADE DE ARTES, CIÊNCIAS E TECNOLOGIAS;FACET;BA
29922,42921;FACULDADE DE CIÊNCIAS SOCIAIS APLICADAS;FACISA - CELER;SC
29926,30367;Faculdade Anhanguera de São Caetano;Fasc;SP
29930,17813;FACULDADE DE COLIDER;FACIDER;MT
29934,05258;INSTITUTO MACHADENSE DE ENSINO SUPERIOR;IMES;MG
29937,92704;FACULDADE DE ADMINISTRAÇÃO E ARTES DE LIMEIRA;FAAL;SP
29941,8015;FACULDADE CATUAÍ;ICES;PR
29945,67596;INSTITUTO SUPERIOR DE EDUCAÇÃO DO SUL DA BAHIA;ISESB;BA
29949,55042;FACULDADE DE EDUCAÇÃO DE VITÓRIA;AUFES;ES
29953,42488;FACULDADE NORTE PARANAENSE;UNINORTE;PR
29957,29934;FACULDADE EDUCACIONAL DE CORNÉLIO PROCÓPIO;FACED;PR
29961,1738;FACULDADE DE REALEZA;CESREAL;PR
29965,04825;FACULDADE DOM BOSCO DE UBIRATÃ;DOM BOSCO UBIRATÃ;PR
29968,92271;FACULDADE DE CIÊNCIAS DA SAÚDE;FASU;SP
29972,79717;FACULDADE DE TECNOLOGIA E CIÊNCIAS DE PERNAMBUCO;FATEC;PE
29976,67163;FACULDADE DE MAUÁ - FAMA;FAMA;SP
29980,54609;FACULDADE DOS GUARARAPES;FG;PE
29984,42055;FACULDADE FERNÃO DIAS;FAFE;SP
29988,29501;INSTITUTO FEDERAL DE EDUCAÇÃO, CIÊNCIA E TECNOLOGIA DO CEARÁ;IFCE;CE
29992,16947;INSTITUTO FEDERAL DE EDUCAÇÃO, CIÊNCIA E TECNOLOGIA DO ESPÍRITO SANTO;IFES;ES
29996,04392;INSTITUTO FEDERAL DE EDUCAÇÃO, CIÊNCIA E TECNOLOGIA DE PERNAMBUCO;IFPE;PE
29999,91838;INSTITUTO FEDERAL DE EDUCAÇÃO, CIÊNCIA E TECNOLOGIA DE SÃO PAULO;IFSP;SP
30003,79284;INSTITUTO FEDERAL DE EDUCAÇÃO, CIÊNCIA E TECNOLOGIA DE GOIÁS;IFG;GO
30007,6673;INSTITUTO FEDERAL DE EDUCAÇÃO, CIÊNCIA E TECNOLOGIA  DO AMAZONAS;IFAM;AM
30011,54176;INSTITUTO FEDERAL DE EDUCAÇÃO, CIÊNCIA E TECNOLOGIA DO PARÁ;IFPA;PA
30015,41622;FACULDADE DE CIÊNCIAS SOCIAIS E APLICADAS DE DIAMANTINO;UNED;MT
30019,29068;FACULDADE DO INSTITUTO BRASIL;FIBRA;GO
30023,16514;INSTITUTO DE ENSINO SUPERIOR DE BAURU;IESB;SP
30027,03959;Faculdade Estácio de Curitiba;;PR
30030,91405;FACULDADE PITÁGORAS DE BELO HORIZONTE;FPAS;MG
30034,78851;FACULDADE FARIAS BRITO;FFB;CE
30038,66297;INSTITUTO FEDERAL DE EDUCAÇÃO, CIÊNCIA E TECNOLOGIA DO PIAUÍ;IFPI;PI
30042,53743;FACULDADE LIONS;FAC-LIONS;GO
30046,41189;FACULDADE SUL-AMERICANA;FASAM;GO
30050,28635;INSTITUTO DE ENSINO SUPERIOR DO AMAPÁ;IESAP;AP
30054,16081;FACULDADE DE CIÊNCIAS CONTÁBEIS DE ITABIRITO;FACCI;MG
30058,03527;FACULDADE DE ESTUDOS SUPERIORES DE MINAS GERAIS;FEAD;MG
30061,90972;FACULDADE LUTERANA DE TEOLOGIA;FLT;SC
30065,78418;ESCOLA DA CIDADE - FACULDADE DE ARQUITETURA E URBANISMO;ESCOLA DA CIDADE;SP
30069,65864;FACULDADE ANHANGUERA DE PASSO FUNDO;;RS
30073,5331;FACULDADE CENTRO PAULISTA;CESI;SP
30077,40756;FACULDADE DE JABOTICABAL;FAJAB;SP
30081,28202;FACULDADE DE ARUJÁ;FAR;SP
30085,15648;FACULDADE DE AGUDOS;FAAG;SP
30089,03094;FACULDADE INTEGRADA DE ENSINO SUPERIOR DE COLINAS;FIESC;TO
30092,90539;CENTRO UNIVERSITÁRIO FUNDAÇÃO DE ENSINO OCTÁVIO BASTOS - FEOB;UNIFEOB;SP
30096,77985;ESCOLA DE ESTUDOS SUPERIORES DE VIÇOSA;ESUV;MG
30100,65431;FACULDADES INTEGRADAS RIO BRANCO;FRB;SP
30104,52877;FACULDADES INTEGRADAS DE VÁRZEA GRANDE;FIAVEC;MT
30108,40323;FACULDADE CASTELO BRANCO;FCB;ES
30112,27769;FACULDADES INTEGRADAS ANTÔNIO EUFRÁSIO DE TOLEDO DE PRESIDENTE PRUDENTE;FIAETPP;SP
30116,15215;FACULDADES INTEGRADAS MACHADO DE ASSIS;FEMA;RS
30120,02661;FACULDADE DE ADMINISTRAÇÃO DE CAMPO BELO;FACAMP;MG
30123,90106;FACULDADES INTEGRADAS STELLA MARIS DE ANDRADINA;FISMA;SP
30127,77552;FEFISA - FACULDADES INTEGRADAS DE SANTO ANDRÉ;FEFISA;SP
30131,64998;CENTRO UNIVERSITÁRIO DE LINS;UNILINS;SP
30135,52444;FACULDADE ATENAS MARANHENSE DE IMPERATRIZ;FAMA;MA
30139,3989;FACULDADE ALVORADA DE TECNOLOGIA E EDUCAÇÃO DE MARINGÁ;FACULDADE ALVORADA;PR
30143,27336;ESCOLA BRASILEIRA DE ADMINISTRAÇÃO PÚBLICA E DE EMPRESAS;EBAPE;RJ
30147,14782;FACULDADE SABERES;SABERES;ES
30151,02228;FACULDADE DE TECNOLOGIA IBTA;IBTA;SP
30154,89673;FACULDADES INTEGRADAS CLARETIANAS;FIC;SP
30158,77119;FACULDADE DO NORTE NOVO DE APUCARANA;FACNOPAR;PR
30162,64565;FACULDADE DEHONIANA;DEHONIANA;SP
30166,52011;FACULDADE INTEGRADA EUCLIDES FERNANDES;FAJ;BA
30170,39457;FACULDADE DE CIÊNCIAS GERENCIAIS PADRE ARNALDO JANSSEN;FAJANSSEN;MG
30174,26903;FACULDADE DA REGIÃO SERRANA;FARESE;ES
30178,14349;FACULDADE DE MANTENA;FAMA;MG
30182,01795;FACULDADE DE ADMINISTRAÇÃO DA ASSOCIAÇÃO BRASILIENSE DE EDUCAÇÃO;FABE;RS
30185,8924;INSTITUTO SUPERIOR DE EDUCAÇÃO ALVORADA PLUS;ISEAP;SP
30189,76686;FACULDADE DE CIÊNCIAS EMPRESARIAIS E ESTUDOS COSTEIROS DE NATAL;FACEN;RN
30193,64132;FACULDADE DE CIÊNCIAS GERENCIAIS DE SANTOS DUMONT;FACIG;MG
30197,51578;INSTITUTO SUPERIOR DE EDUCAÇÃO DE SANTOS DUMONT;ISESD;MG
30201,39024;CENTRO UNIVERSITÁRIO DE ITAJUBÁ;UNIVERSITAS;MG
30205,2647;FACULDADES INTEGRADAS REGIONAIS DE AVARÉ;FIRA;SP
30209,13916;FACULDADES INTEGRADAS SANTA CRUZ DE CURITIBA;FARESC;PR
30213,01362;FACULDADE MERCÚRIO;FAMERC;RJ
30216,88807;FACULDADE DE TECNOLOGIA DE OURINHOS;FATEC;SP
30220,76253;FACULDADE DE FILOSOFIA, CIÊNCIAS E LETRAS DE IBITINGA;FAIBI;SP
30224,63699;FACULDADE MUNICIPAL PROFESSOR FRANCO MONTORO DE MOGI GUAÇU;FMPFM;SP
30228,51145;FACULDADE ATUAL;FAAT;AP
30232,38591;CENTRO UNIVERSITÁRIO DA FUNDAÇÃO EDUCACIONAL INACIANA PE SABÓIA DE MEDEIROS;FEI;SP
30236,26037;FACULDADE EDUCACIONAL DE ARAUCÁRIA;FACEAR;PR
30240,13483;FACULDADE CASA DO ESTUDANTE;FACE;ES
30244,00929;FACULDADE DA ESCADA;FAESC;PE
30247,88374;FACULDADE DE CIÊNCIAS AGRÁRIAS E DA SAÚDE;FAS;BA
30251,7582;FACULDADE RANCHARIENSE;FRAN;SP
30255,63266;UNIDADE DE ENSINO SUPERIOR DOM BOSCO;UNDB;MA
30259,50712;FACULDADE DE MONTE ALTO;FMA;SP
30263,38158;FACULDADE DE DIREITO DA SERRA;FABAVI;ES
30267,25604;FACULDADE ÁVILA;FAC;GO
30271,1305;Faculdade Sartre COC;FACOC SALVADOR;BA
30275,00496;FACULDADE ENIAC;ENIAC;SP
30278,87941;ESCOLA DE NEGÓCIOS DO ESTADO DA BAHIA - ENEB;ENEB;BA
30282,75387;FACULDADE EUROPÉIA DE ADMINISTRAÇÃO E MARKETING;FEPAM;PE
30286,62833;FACULDADE CHRISTUS;CHRISTUS;CE
30290,50279;FACULDADE DO LITORAL SUL PAULISTA;FALS;SP
30294,37725;FACULDADE DO NOROESTE PARANAENSE;FANP;PR
30298,25171;FACULDADE ANCHIETA DE ENSINO SUPERIOR DO PARANÁ;FAESP;PR
30302,12617;FACULDADE CATÓLICA DE UBERLÂNDIA;CATÓLICA;MG
30306,00063;FACULDADE CRISTO REI;FACCREI;PR
30309,87509;FACULDADE SÃO CAMILO;FASC;RJ
30313,74954;INSTITUTO DE ENSINO SUPERIOR MATERDEI;IES-MATERDEI;AM
30317,624;FACULDADE EDUCACIONAL DE COLOMBO;FAEC;PR
30321,49846;ESCOLA DE ENSINO SUPERIOR ALTERNATIVO;CESA;ES
30325,37292;FACULDADE PEREIRA DE FREITAS;FPF;MG
30329,24738;FACULDADE BAIANA DE CIÊNCIAS;FABAC;BA
30333,12184;FACULDADE DE MINAS;FAMINAS;MG
30336,9963;FACULDADE DE CIÊNCIAS BIOMÉDICAS DE CACOAL;FACIMED;RO
30340,87076;FACULDADE CAPIVARI;FUCAP;SC
30344,74521;FACULDADE DE CIÊNCIAS EXATAS E TECNOLÓGICAS SANTO AGOSTINHO - FACET;FACET;MG
30348,61967;FACULDADE DE SÃO BENTO;FSB;SP
30352,49413;FACULDADE DE DIREITO PADRE ARNALDO JANSSEN;FAJANSSEN;MG
30356,36859;FACULDADE DE CIÊNCIAS SOCIAIS APLICADAS SANTO AGOSTINHO;FACISA;MG
30360,24305;FACULDADE DE ADMINISTRAÇÃO DE CATAGUASES;UNIPACAT;MG
30364,11751;FACULDADES INTEGRADAS DO VALE DO IGUAÇU;;PR
30367,99197;FACULDADE CENECISTA ILHA DO GOVERNADOR;FACIG;RJ
30371,86643;INSTITUTO SUPERIOR DE EDUCAÇÃO DE SÃO PAULO;SINGULARIDADES/ISESP;SP
30375,74088;INSTITUTO DE ENSINO SUPERIOR FRANCISCANO;IESF;MA
30379,61534;FACULDADE PALOTINA;FAPAS;RS
30383,4898;FACULDADE BIRIGUI;FABI;SP
30387,36426;FACULDADE SINOP;FASIP;MT
30391,23872;FACULDADE LA SALLE;;MT
30395,11318;FACULDADE EVANGÉLICA DE SALVADOR;FACESA;BA
30398,98764;FACULDADE GLOBAL DE UMUARAMA;FGU;PR
30402,8621;INSTITUTO DE ENSINO SUPERIOR DE LONDRINA - INESUL;INESUL;PR
30406,73655;FACULDADE DE NOVA SERRANA;FANS;MG
30410,61101;FACULDADE CUIABÁ;FAUC;MT
30414,48547;FACULDADE SERRANA DE ENSINO SUPERIOR;FASEP;DF
30418,35993;FACULDADE DE TECNOLOGIA IBRATEC;UNIBRATEC;PE
30422,23439;FACULDADE DE SORRISO;FAIS;MT
30426,10885;FACULDADE LEGALE;FALEG;SP
30429,98331;FACULDADE DE ENSINO SUPERIOR DA PARAÍBA;FESP;PB
30433,85777;FACULDADE DE PAULÍNIA;FACP;SP
30437,73222;FACULDADE DE ORLÂNDIA;FAO;SP
30441,60668;INSTITUTO DE EDUCAÇÃO E ENSINO SUPERIOR DE SAMAMBAIA;IESA;DF
30445,48114;FACULDADE DE CIÊNCIAS JURÍDICAS E SOCIAIS APLICADAS DO ARAGUAIA;FACULDADES CATHEDRAL;MT
30449,3556;INSTITUTO BATISTA DE ENSINO SUPERIOR DE ALAGOAS;IBESA;AL
30453,23006;FACULDADE DE TECNOLOGIA SENAI JOINVILLE;SENAI DE JOINVILLE;SC
30457,10452;FACULDADE DE TECNOLOGIA SENAI BLUMENAU;CET BLUMENAU;SC
30460,97898;INSTITUTO TECNOLÓGICO E DAS CIÊNCIAS SOCIAIS APLICADAS E DA SAÚDE DO CENTRO EDUC. N. SRª AUXILIADORA;ITCSAS/CENSA;RJ
30464,85344;INSTITUTO SUPERIOR DE EDUCAÇÃO DO CENTRO EDUCACIONAL NOSSA SENHORA AUXILIADORA;ISECENSA;RJ
30468,72789;FACULDADE DE TECNOLOGIA EM HOTELARIA, GASTRONOMIA E TURISMO DE SÃO PAULO;HOTEC;SP
30472,60235;FACULDADE DE TECNOLOGIA DE ALAGOAS;FAT/AL;AL
30476,47681;FACULDADE ALBERT EINSTEIN;FALBE;DF
30480,35127;FACULDADE DO VALE DO ITAPECURÚ;FAI;MA
30484,22573;FACULDADE ATLÂNTICO;FA;SE
30488,10019;FACULDADE DOS IMIGRANTES - FAI;FAI;RS
30491,97465;FACULDADE DO ESPÍRITO SANTO;UNES;ES
30495,84911;FACULDADE TIJUCUSSU;TIJUCUSSU;SP
30499,72356;INSTITUTO SUPERIOR DE EDUCAÇÃO ORÍGENES LESSA;ISEOL;SP
30503,59802;CENTRO DE ESTUDOS SUPERIORES APRENDIZ;CESA;MG
30507,47248;FACULDADE METROPOLITANA DA GRANDE FORTALEZA;FAMETRO;CE
30511,34694;FACULDADE SINERGIA;SINERGIA;SC
30515,2214;FACULDADE DE CIÊNCIAS GERENCIAIS DE MANHUAÇU;FACIG;MG
30519,09586;FACULDADE ESTÁCIO DE SÁ DE JUIZ DE FORA;FESJF;MG
30522,97032;FACULDADE AVANTIS;AVANTIS;SC
30526,84478;INSTITUTO DE ENSINO SUPERIOR DE PIEDADE;IESP;PE
30530,71923;FACULDADE DE MEDICINA NOVA ESPERANÇA;FAMENE;PB
30534,59369;INSTITUTO CUIABÁ DE ENSINO E CULTURA;ICEC;MT
30538,46815;INSTITUTO SUPERIOR DE EDUCAÇÃO ELVIRA DAYRELL;ISEED;MG
30542,34261;SEMINÁRIO ADVENTISTA LATINO-AMERICANO DE TEOLOGIA;SALT;BA
30546,21707;FACULDADE DE CIÊNCIAS SOCIAIS APLICADAS DE SINOP;FACISAS;MT
30550,09153;FACULDADE DE TAQUARITINGA;FSG;SP
30553,96599;FACULDADE DE CIÊNCIAS E LETRAS;ACADEMIA DE ENSINO;SP
30557,84045;INSTITUTO SUPERIOR DE EDUCAÇÃO DE PESQUEIRA;ISEP;PE
30561,7149;FACULDADE SETELAGOANA DE CIÊNCIAS GERENCIAIS;FASCIG;MG
30565,58936;INSTITUTO SANTO TOMÁS DE AQUINO;ISTA;MG
30569,46382;INSTITUTO SUPERIOR DE EDUCAÇÃO DE SALGUEIRO;ISES;PE
30573,33828;FACULDADE JK - UNIDADE II - GAMA;;DF
30577,21274;FACULDADE DE ROLIM DE MOURA;FAROL;RO
30581,0872;FACULDADE DE GUANAMBI;;BA
30584,96166;FACULDADE DE CAMPINA GRANDE;FAC-CG;PB
30588,83612;INSTITUTO SUPERIOR DE EDUCAÇÃO CAMPO LIMPO PAULISTA;ISECAMP;SP
30592,71058;FACULDADE DE PEDAGOGIA E FORMAÇÃO DE NORMALISTAS DE ARAGUAÍNA;ITPAC;TO
30596,58503;INSTITUTO SUPERIOR DE EDUCAÇÃO DE FLORESTA;ISEF;PE
30600,45949;FACULDADE DE CIÊNCIAS CONTÁBEIS DE ARAGUAÍNA;ITPAC;TO
30604,33395;FACULDADE JAGUARIAÍVA;FAJAR;PR
30608,20841;Faculdade Estácio do Pará - Estácio FAP;FAP;PA
30612,08287;FACULDADE UNIME DE CIÊNCIAS EXATAS E TECNOLÓGICAS;FCT;BA
30615,95733;FACULDADE CIDADE LUZ;FACILUZ;SP
30619,83179;FACULDADE DO FUTURO;FAF;MG
30623,70625;FACULDADE SUDAMÉRICA;SUDAMÉRICA;MG
30627,5807;FACULDADE FIGUEIREDO COSTA - FIC;;AL
30631,45516;FACULDADE VALE DO SALGADO;FVS;CE
30635,32962;FACULDADE AMADEUS;FAMA;SE
30639,20408;INSTITUTO DE ESTUDOS SUPERIORES DO MARANHÃO;IESMA;MA
30643,07854;FACULDADE DE EDUCAÇÃO DE NOVA ANDRADINA;FENA;MS
30646,953;FACULDADE DA ALTA PAULISTA;FAP;SP
30650,82746;FACULDADE METROPOLITANA;UNNESA;RO
30654,70192;FACULDADE DE CIÊNCIAS EMPRESARIAIS;FACEMP;BA
30658,57637;FACULDADE DE TEOLOGIA E CIÊNCIAS HUMANAS;FATECH;AP
30662,45083;FACULDADE DE DESENVOLVIMENTO SUSTENTÁVEL DE CRUZEIRO DO SUL;IEVAL;AC
30666,32529;INSTITUTO SUPERIOR DE EDUCAÇÃO PADRÃO;ISE-PADRAO;GO
30670,19975;INSTITUTO DE ENSINO SUPERIOR DE ALAGOAS;IESA;AL
30674,07421;FACULDADE REGIONAL DA BAHIA;FARB;BA
30677,94867;FACULDADE ANGLO-AMERICANO;FAA;PR
30681,82313;FACULDADE DE ITAITUBA;FAI;PA
30685,69759;FACULDADE DE CIÊNCIAS MÉDICAS DA PARAÍBA;FCM-PB;PB
30689,57204;FACULDADE CENECISTA DE NOVA PETRÓPOLIS;FACENP;RS
30693,4465;INSTITUTO BAIANO DE ENSINO SUPERIOR;IBES;BA
30697,32096;INSTITUTO DE ENSINO SUPERIOR DE FOZ DO IGUAÇU;IESFI;PR
30701,19542;INSTITUTO SUPERIOR DE EDUCAÇÃO PRÓ-SABER;ISEPS;RJ
30705,06988;FACULDADE DE CIÊNCIAS JURÍDICAS E GERENCIAIS DE MANHUAÇU;FACULDADES DOCTUM;MG
30708,94434;FACULDADE KURIOS;FAK;CE
30712,8188;FACULDADE DE AURIFLAMA;FAU;SP
30716,69326;INSTITUTO SUPERIOR DE TEOLOGIA APLICADA;INTA;CE
30720,56771;FACULDADE DOM BOSCO DE PORTO ALEGRE;FDB;RS
30724,44217;FACULDADE DE CIÊNCIA E TECNOLOGIA;FACITEC;PR
30728,31663;INSTITUTO DE FILOSOFIA E DE TEOLOGIA PAULO VI;IFITEPS;RJ
30732,19109;Faculdade Estácio de Sergipe - Estácio FASE;FASE;SE
30736,06555;FACULDADE MAX PLANCK;AESI;SP
30739,94001;FACULDADE CALAFIORI;CALAFIORI;MG
30743,81447;ESCOLA DE DIREITO DO RIO DE JANEIRO;DIREITO RIO;RJ
30747,68893;ESCOLA DE DIREITO DE SÃO PAULO;DIREITO GV;SP
30751,56338;ESCOLA DE ECONOMIA DE SÃO PAULO;EESP;SP
30755,43784;FACULDADE FAPAN;FAPAN;SP
30759,3123;FACULDADE BARÃO DO RIO BRANCO;FAB;AC
30763,18676;FACULDADE DE CIÊNCIAS, EDUCAÇÃO E TEOLOGIA DO NORTE DO BRASIL;FACETEN;RR
30767,06122;FACULDADE DA IGREJA MINISTÉRIO FAMA;FAIFA;GO
30770,93568;FACULDADE CATÓLICA RAINHA DO SERTÃO;FCRS;CE
30774,81014;FACULDADE SÃO MARCOS;FASAMAR;TO
30778,6846;INSTITUTO SUPERIOR DE EDUCAÇÃO NOSSA SENHORA DE LOURDES;FNSL;BA
30782,55905;FACULDADE TEOLÓGICA BATISTA DO PARANÁ;FTBP;PR
30786,43351;FACULDADE INFÓRIUM DE TECNOLOGIA;FIT;MG
30790,30797;FACULDADE DO ACRE;FAC;AC
30794,18243;FACULDADE METROPOLITANA DE MANAUS;FAMETRO;AM
30798,05689;FACULDADE DE PALMAS;FAPAL;TO
30801,93135;FACULDADE MATO GROSSO DO SUL;FACSUL;MS
30805,80581;FACULDADE DO PIAUÍ;FAPI;PI
30809,68027;INSTITUTO SUPERIOR DE EDUCAÇÃO BERLAAR;IBERLAAR;MG
30813,55472;INSTITUTO SUPERIOR DE CIÊNCIAS HUMANAS E SOCIAIS ANÍSIO TEIXEIRA;ISAT;RJ
30817,42918;FACULDADE SÃO TOMÁS DE AQUINO;FACESTA;AL
30821,30364;INSTITUTO SUPERIOR DE EDUCAÇÃO SANT´ANA;ISESA;PR
30825,1781;FACULDADE SANTA MARIA;FSM;PB
30829,05256;FACULDADE SANT'ANA;IESSA;PR
30832,92702;INSTITUTO SUPERIOR DE EDUCAÇÃO EUGÊNIO GOMES;ISEGO;BA
30836,80148;FACULDADE FOZ DO IGUAÇU;FAFIG;PR
30840,67594;FACULDADE CAMPO GRANDE;FCG;MS
30844,5504;INSTITUTO BELO HORIZONTE DE ENSINO SUPERIOR;IBHES;MG
30848,42485;FACULDADE GUAIANÁS;FAG;SP
30852,29931;FACULDADE DE SANTA CATARINA;FASC;SC
30856,17377;FACULDADE METROPOLITANA DE BLUMENAU;FAMEBLU;SC
30860,04823;INSTITUTO PAULISTA DE ENSINO;FIPEN;SP
30863,92269;RATIO - FACULDADE TEOLÓGICA E FILOSÓFICA;RATIO;CE
30867,79715;CENTRO UNIVERSITÁRIO FUNDAÇÃO SANTO ANDRÉ;CUFSA;SP
30871,67161;FACULDADE CENECISTA NOSSA SENHORA DOS ANJOS;FACENSA;RS
30875,54607;FACULDADE SALESIANA DOM BOSCO;FSDB;AM
30879,42052;INSTITUTO SUPERIOR DE EDUCAÇÃO NOSSA SENHORA DE SION;ISE - SION;PR
30883,29498;FACULDADE DO MARANHÃO;FACAM-MA;MA
30887,16944;FACULDADE ANHANGUERA DE PELOTAS;;RS
30891,0439;INSTITUTO SUPERIOR DE EDUCAÇÃO IVOTI;ISEI;RS
30894,91836;FACULDADE ANHANGUERA DO RIO GRANDE;;RS
30898,79282;FACULDADE MONTEIRO LOBATO;FATO;RS
30902,66728;FACULDADE VALE DO GORUTUBA;FAVAG;MG
30906,54174;INSTITUTO SUPERIOR DE EDUCAÇÃO DE GUARATUBA;ISEPE;PR
30910,41619;FACULDADE DE TUPI PAULISTA;CESTUPI;SP
30914,29065;FACULDADE FAE SÃO JOSÉ DOS PINHAIS;;PR
30918,16511;FACULDADE DE CIÊNCIAS JURÍDICAS DE JUIZ DE FORA;FACULDADES DOCTUM;MG
30922,03957;FACULDADE SETE DE SETEMBRO;FASETE;BA
30925,91403;FACULDADE VICTOR HUGO;FVH;MG
30929,78849;FACULDADE DE CIÊNCIAS SOCIAIS APLICADAS DE BELO HORIZONTE;FACISABH;MG
30933,66295;FACULDADE TEOLÓGICA BATISTA EQUATORIAL;FATEBE;PA
30937,53741;FACULDADE DE FORTALEZA;FAFOR;CE
30941,41186;FACULDADE DO SUDESTE MINEIRO;FACSUM;MG
30945,28632;FACULDADE DO RECIFE;FAREC;PE
30949,16078;FACULDADE PARAÍBANA;FAP;PB
30953,03524;FACULDADE DA CIDADE DE MACEIÓ;FACIMA;AL
30956,9097;FACULDADE DO ESPÍRITO SANTO;FACES;ES
30960,78416;FACULDADE UNIÃO AMERICANA;UNIÃO AMERICANA;RN
30964,65862;FACULDADE CHAFIC;CHAFIC;SP
30968,53308;FACULDADE SERGIPANA;FASER;SE
30972,40753;FACULDADE STELLA MARIS;FSM;CE
30976,28199;FACULDADE DIADEMA;FAD;SP
30980,15645;FACULDADE DE COMUNICAÇÃO PITÁGORAS UNIDADE GUARAPARI;PIT GUARAPARI;ES
30984,03091;FACULDADE CAMBURY DE FORMOSA;CAMBURY;GO
30987,90537;FACULDADE DE CIÊNCIAS SOCIAIS APLICADAS DE EXTREMA;FAEX;MG
30991,77983;FACULDADE PITÁGORAS DE IPATINGA;FPI;MG
30995,65429;FACULDADE DE DIREITO SANTO AGOSTINHO;FADISA;MG
30999,52875;FACULDADE INTEGRADA METROPOLITANA DE CAMPINAS;METROCAMP;SP
31003,4032;FACULDADE DE CAFELÂNDIA;FAC;PR
31007,27766;ESCOLA SUPERIOR DE TEOLOGIA E ESPIRITUALIDADE FRANCISCANA;ESTEF;RS
31011,15212;FACULDADE ALMEIDA RODRIGUES;FAR;GO
31015,02658;FACULDADES INTEGRADAS DE ANGELES;FIA;SP
31018,90104;FACULDADE DE DIREITO DE SANTA MARIA;FADISMA;RS
31022,7755;FACULDADE FIDELIS;FF;PR
31026,64996;FACULDADE GEREMÁRIO DANTAS;SFNSC;RJ
31030,52442;FACULDADE DE CIÊNCIAS JURÍDICAS PROFESSOR ALBERTO DEODATO;FCJPAD;MG
31034,39887;FACULDADE LUTERANA RUI BARBOSA;FALURB;PR
31038,27333;FACULDADE DO DESCOBRIMENTO;FACDESCO;BA
31042,14779;ESCOLA SUPERIOR DE EDUCAÇÃO CORPORATIVA;ESEC;SC
31046,02225;INSTITUTO SUPERIOR DE EDUCAÇÃO ATENEU;ISEAT;ES
31049,89671;FACULDADE ATENEU;FATE;ES
31053,77117;FACULDADE DA AMAZÔNIA;FAMA;RO
31057,64563;FACULDADE UNIÃO BANDEIRANTE;FACULDADE UNIBAN;SC
31061,52009;FACULDADE ITEANA DE BOTUCATU;FITB;SP
31065,39454;FACULDADE CÂNDIDO RONDON - FCR;FCR;MT
31069,269;FACULDADE CORPORATIVA CESPI;FACESPI;SP
31073,14346;INSTITUTO SUPERIOR MENDES DE ALMEIDA;IMA;RJ
31077,01792;FACULDADE MONTES BELOS;FMB;GO
31080,89238;FACULDADE DA ALDEIA DE CARAPICUÍBA;FALC;SP
31084,76684;INSTITUTO SUPERIOR DE EDUCAÇÃO CERES;ISE-CERES;SP
31088,6413;FACULDADE DA AMAZÔNIA OCIDENTAL;FAAO;AC
31092,51576;INSTITUTO SUPERIOR DE FILOSOFIA BERTHIER;IFIBE;RS
31096,39021;INSTITUIÇÃO DE ENSINO SÃO FRANCISCO;IESF;SP
31100,26467;ESCOLA SUPERIOR MADRE CELESTE;ESMAC;PA
31104,13913;FACULDADE ESPÍRITO SANTENSE DE CIÊNCIAS JURÍDICAS;PIO XII - DIR;ES
31108,01359;FACULDADE ANHANGUERA DE MATÃO;;SP
31111,88805;FACULDADE PAN AMERICANA;FPA;PA
31115,76251;FACULDADE PADRÃO;-;GO
31119,63697;FACULDADE DE CIÊNCIAS MÉDICAS DE CAMPINA GRANDE;FCM;PB
31123,51143;FACULDADE DE ADMINISTRAÇÃO DE EMPRESAS DE PARAÍSO DO TOCANTINS;FAP;TO
31127,38589;FACULDADE CATÓLICA DO TOCANTINS;FACTO;TO
31131,26034;FACULDADE DE SISTEMAS DE INFORMAÇÃO DE PARAÍSO DO TOCANTINS;FSIP;TO
31135,1348;FACULDADE DE ODONTOLOGIA SÃO LEOPOLDO MANDIC;SLMANDIC;SP
31139,00926;INSTITUTO DE ENSINO SUPERIOR SANTO ANTÔNIO;INESA;SC
31142,88372;Faculdade Estácio do Amapá - Estácio FAMAP;FAMAP;AP
31146,75818;FACULDADE MERIDIONAL;IMED;RS
31150,63264;FACULDADE INTEGRADA DO BRASIL;FAIBRA;PI
31154,5071;FACULDADE DE FILOSOFIA E TEOLOGIA PAULO VI;FFTP;SP
31158,38156;FACULDADE DE CAMPO VERDE;FCV;MT
31162,25601;FACULDADE FUCAPE;FUCAPE;ES
31166,13047;INSTITUTO SUPERIOR DE EDUCAÇÃO DE CAMPO VERDE;ISE - CAMPO VERDE;MT
31170,00493;FACULDADE DE SOROCABA;;SP
31173,87939;FACULDADE CIDADE DO SALVADOR;FCS;BA
31177,75385;ESCOLA SUPERIOR DE ADMINISTRAÇÃO, MARKETING E COMUNICAÇÃO DE SANTOS;ESAMC SANTOS;SP
31181,62831;FACULDADE ASCES;ASCES;PE
31185,50277;FACULDADE CEARENSE;FAC;CE
31189,37723;FACULDADE DE ENSINO SUPERIOR DE FLORIANO;FAESF;PI
31193,25168;FACULDADE PARANAENSE;FAPAR;PR
31197,12614;FACULDADE DE CIÊNCIA E TECNOLOGIA DE MONTES CLAROS;FACIT;MG
31201,0006;FACULDADE INTEGRADA BRASIL AMAZONIA - FIBRA;FIBRA;PA
31204,87506;FACULDADE DE CIÊNCIAS E TECNOLOGIAS DE CAMPOS GERAIS;FACICA;MG
31208,74952;FACULDADE ESTÁCIO MONTESSORI DE IBIÚNA;FMI;SP
