id;name;acronym;state
1;UNIVERSIDADE FEDERAL DE MATO GROSSO;UFMT;MT
2;UNIVERSIDADE DE BRASÍLIA;UNB;DF
3;UNIVERSIDADE FEDERAL DE SERGIPE;UFS;SE
4;UNIVERSIDADE FEDERAL DO AMAZONAS;UFAM;AM
5;UNIVERSIDADE FEDERAL DO PIAUÍ;UFPI;PI
6;UNIVERSIDADE FEDERAL DE OURO PRETO;UFOP;MG
7;UNIVERSIDADE FEDERAL DE SÃO CARLOS;UFSCAR;SP
8;UNIVERSIDADE FEDERAL DE VIÇOSA;UFV;MG
9;UNIVERSIDADE ESTADUAL DE LONDRINA;UEL;PR
10;PONTIFÍCIA UNIVERSIDADE CATÓLICA DO PARANÁ;PUCPR;PR
11;UNIVERSIDADE CATÓLICA DE PERNAMBUCO;UNICAP;PE
12;UNIVERSIDADE FEDERAL DO RIO GRANDE;FURG;RS
13;UNIVERSIDADE DE CAXIAS DO SUL;UCS;RS
14;UNIVERSIDADE DO VALE DO RIO DOS SINOS;UNISINOS;RS
15;UNIVERSIDADE CATÓLICA DE PETRÓPOLIS;UCP;RJ
16;UNIVERSIDADE GAMA FILHO;UGF;RJ
17;UNIVERSIDADE FEDERAL DE UBERLÂNDIA;UFU;MG
18;UNIVERSIDADE CATÓLICA DE PELOTAS;UCPEL;RS
19;PONTIFÍCIA UNIVERSIDADE CATÓLICA DE CAMPINAS;PUC-CAMPINAS;SP
20;UNIVERSIDADE DE PASSO FUNDO;UPF;RS
21;PONTIFÍCIA UNIVERSIDADE CATÓLICA DO RIO GRANDE DO SUL;PUCRS;RS
22;UNIVERSIDADE PRESBITERIANA MACKENZIE;MACKENZIE;SP
23;UNIVERSIDADE FEEVALE;FEEVALE;RS
24;UNIVERSIDADE ESTADUAL DE SANTA CRUZ;UESC;BA
26;ESCOLA NACIONAL DE CIÊNCIAS ESTATÍSTICAS;ENCE;RJ
27;UNIVERSIDADE VALE DO RIO VERDE;UNINCOR;MG
29;UNIVERSIDADE ESTADUAL DO CEARÁ;UECE;CE
30;UNIVERSIDADE JOSÉ DO ROSÁRIO VELLANO;UNIFENAS;MG
31;CENTRO DE EDUCAÇÃO TÉCNICA DA UTRAMIG;UTRAMIG;MG
32;UNIVERSIDADE ESTADUAL DE CIÊNCIAS DA SAÚDE DE ALAGOAS - UNCISAL;UNCISAL;AL
33;FACULDADE DE TECNOLOGIA DE SOROCABA;FATEC SO;SP
34;FACULDADE DE TECNOLOGIA DE SÃO PAULO;FATEC-SP;SP
35;FACULDADE DE TECNOLOGIA DE AMERICANA;FATEC-AM;SP
36;FACULDADE DE TECNOLOGIA RUBENS LARA;FATEC-BS;SP
37;FACULDADE DE TECNOLOGIA DE JAHU;FATEC-JAHU;SP
38;UNIVERSIDADE DO ESTADO DO PARÁ;UEPA;PA
40;UNIVERSIDADE DO ESTADO DA BAHIA;UNEB;BA
43;FUNDAÇÃO UNIVERSIDADE DO ESTADO DE SANTA CATARINA;UDESC;SC
46;FACULDADE ESTADUAL DE CIÊNCIAS ECONÔMICAS DE APUCARANA;FECEA;PR
47;UNIVERSIDADE ESTADUAL DE GOIÁS;UEG;GO
54;UNIVERSIDADE ESTADUAL DE CAMPINAS;UNICAMP;SP
55;UNIVERSIDADE DE SÃO PAULO;USP;SP
56;UNIVERSIDADE ESTADUAL PAULISTA JÚLIO DE MESQUITA FILHO;UNESP;SP
57;UNIVERSIDADE ESTADUAL DE MARINGÁ;UEM;PR
58;FACULDADE DE DIREITO DE SÃO BERNARDO DO CAMPO;FDSBC;SP
59;FACULDADE DE DIREITO DE FRANCA;FDF;SP
60;CENTRO UNIVERSITÁRIO DE FRANCA;UNI-FACEF;SP
67;ESCOLA DE ENGENHARIA DE PIRACICABA;EEP/FUMEP;SP
68;FACULDADE DE FILOSOFIA CIÊNCIAS E LETRAS DE PENÁPOLIS;FAFIPE;SP
71;UNIVERSIDADE DO ESTADO DO RIO GRANDE DO NORTE;UERN;RN
72;FACULDADE DE FORMAÇÃO DE PROFESSORES DA MATA SUL;FAMASUL;PE
73;CENTRO DE ENSINO SUPERIOR DE ARCOVERDE;CESA;PE
74;FACULDADE DE FILOSOFIA CIÊNCIAS E LETRAS DE SÃO JOSÉ DO RIO PARDO;FFCL;SP
75;FACULDADE ESTADUAL DE EDUCAÇÃO CIÊNCIAS E LETRAS DE PARANAVAÍ;FAFIPA;PR
76;UNIVERSIDADE REGIONAL DE BLUMENAU;FURB;SC
77;FACULDADE DA REGIÃO DOS LAGOS;FERLAGOS;RJ
78;FACULDADE DE FILOSOFIA CIÊNCIAS E LETRAS DE ALEGRE;FAFIA;ES
79;INSTITUTO MUNICIPAL DE ENSINO SUPERIOR DE CATANDUVA;IMES CATANDUVA;SP
80;CENTRO UNIVERSITÁRIO PARA O DESENVOLVIMENTO DO ALTO VALE DO ITAJAÍ;UNIDAVI;SC
81;UNIVERSIDADE DA REGIÃO DE JOINVILLE;UNIVILLE;SC
82;UNIVERSIDADE DO OESTE DE SANTA CATARINA;UNOESC;SC
83;UNIVERSIDADE DO VALE DO ITAJAÍ;UNIVALI;SC
84;FACULDADE DE FILOSOFIA CIÊNCIAS E LETRAS DE MACAÉ;FAFIMA;RJ
87;CENTRO UNIVERSITÁRIO DE BRUSQUE;UNIFEBE;SC
88;FACULDADE DE FORMAÇÃO DE PROFESSORES DE PENEDO;FFPP;AL
93;FACULDADE DE MEDICINA DE JUNDIAÍ;FMJ;SP
94;ESCOLA SUPERIOR DE EDUCAÇÃO FÍSICA DE JUNDIAÍ;ESEFJ;SP
95;UNIVERSIDADE ESTADUAL DO VALE DO ACARAÚ;UVA;CE
99;FACULDADE DE DIREITO DE CONSELHEIRO LAFAIETE;FDCL;MG
107;UNIVERSIDADE FEDERAL DE SÃO JOÃO DEL REI;UFSJ;MG
109;FACULDADES INTEGRADAS RUI BARBOSA;FIRB;SP
124;CENTRO UNIVERSITÁRIO DE ARARAQUARA;UNIARA;SP
125;CENTRO UNIVERSITÁRIO DE ARARAS -;UNAR;SP
126;INSTITUTO NACIONAL DE TELECOMUNICAÇÕES;INATEL;MG
131;FACULDADE DE EDUCAÇÃO FÍSICA DE BARRA BONITA;FAEFI;SP
135;CENTRO UNIVERSITÁRIO CLARETIANO;CEUCLAR;SP
137;UNIVERSIDADE DO SAGRADO CORAÇÃO;USC;SP
138;CENTRO UNIVERSITÁRIO BARÃO DE MAUÁ;CBM;SP
139;FACULDADE DE CIÊNCIAS ECONÔMICAS DO TRIÂNGULO MINEIRO;FCETM;MG
140;UNIVERSIDADE SEVERINO SOMBRA;USS;RJ
141;FACULDADE DE DIREITO DE VARGINHA - FADIVA;FADIVA;MG
142;CENTRO UNIVERSITÁRIO DO TRIÂNGULO;UNITRI;MG
143;UNIVERSIDADE DE UBERABA;UNIUBE;MG
144;FACULDADE DE CIÊNCIAS HUMANAS DE OLINDA;FACHO;PE
145;FACULDADE DE CIÊNCIAS HUMANAS E SOCIAIS;FCHS;RJ
146;CENTRO UNIVERSITÁRIO DE RIO PRETO;UNIRP;SP
149;FACULDADE DE MEDICINA DE SÃO JOSÉ DO RIO PRETO;FAMERP;SP
150;UNIVERSIDADE DE SOROCABA;UNISO;SP
151;ESCOLA DE ADMINISTRAÇÃO DE EMPRESAS DE SÃO PAULO;FGV-EAESP;SP
152;FACULDADE DE CIÊNCIAS CONTÁBEIS;FACIC;BA
158;CONSERVATÓRIO BRASILEIRO DE MÚSICA - CENTRO UNIVERSITÁRIO;CBM/CEU;RJ
159;FACULDADE DE FILOSOFIA CIÊNCIAS E LETRAS DE CARUARU;FAFICA;PE
160;FACULDADE FRASSINETTI DO RECIFE;FAFIRE;PE
161;CENTRO UNIVERSITÁRIO ASSUNÇÃO;UNIFAI;SP
162;CENTRO UNIVERSITÁRIO BELAS ARTES DE SÃO PAULO;FEBASP;SP
163;UNIVERSIDADE ESTÁCIO DE SÁ;UNESA;RJ
165;UNIVERSIDADE VEIGA DE ALMEIDA;UVA;RJ
166;FAI - CENTRO DE ENSINO SUPERIOR EM GESTÃO, TECNOLOGIA E EDUCAÇÃO;;MG
167;UNIVERSIDADE METODISTA DE SÃO PAULO;UMESP;SP
170;FACULDADES DA FUNDAÇÃO DE ENSINO DE MOCOCA;FAFEM;SP
171;FACULDADE DE DIREITO DO SUL DE MINAS;FDSM;MG
176;UNIVERSIDADE CASTELO BRANCO;UCB;RJ
190;ESCOLA DE MEDICINA SOUZA MARQUES DA FUNDAÇÃO TÉCNICO-EDUCACIONAL SOUZA MARQUES;EMSM;RJ
191;FACULDADE DE CIÊNCIAS CONTÁBEIS E DE ADMINISTRAÇÃO DE EMPRESAS;FCCAE;RJ
192;FACULDADE DE FILOSOFIA CIÊNCIAS E LETRAS SOUZA MARQUES;FFCLSM;RJ
193;FACULDADE DE ENGENHARIA SOUZA MARQUES;FESM;RJ
194;ESCOLA DE ENFERMAGEM DA FUNDAÇÃO TÉCNICO EDUCACIONAL SOUZA MARQUES;EEFTESM;RJ
195;FACULDADE MORAES JÚNIOR - MACKENZIE RIO;FMJ - MACKENZIE RIO;RJ
197;FACULDADE DE EDUCAÇÃO SUPERIOR DO PARANÁ;FESPRR;PR
198;CENTRO UNIVERSITÁRIO DA CIDADE;UNIVERCIDADE;RJ
200;FACULDADE CÁSPER LÍBERO;FCL;SP
201;FACULDADE BRASILEIRA DE CIÊNCIAS JURÍDICAS;FBCJ;RJ
202;FACULDADE DE ECONOMIA E FINANÇAS DO RIO DE JANEIRO;FEFRJ;RJ
203;UNIVERSIDADE SÃO JUDAS TADEU;USJT;SP
206;CENTRO UNIVERSITÁRIO ÍTALO-BRASILEIRO;UNIÍTALO;SP
207;CENTRO UNIVERSITÁRIO MOURA LACERDA;CUML;SP
208;UNIVERSIDADE DE RIBEIRÃO PRETO;UNAERP;SP
213;CENTRO UNIVERSITÁRIO FECAP;FECAP;SP
214;FACULDADE DE ENGENHARIA DE MINAS GERAIS - FEAMIG;FEAMIG;MG
215;UNIVERSIDADE DO GRANDE ABC;UNIABC;SP
216;CENTRO UNIVERSITÁRIO METODISTA IZABELA HENDRIX;IMIH;MG
217;CENTRO UNIVERSITÁRIO DAS FACULDADES ASSOCIADAS DE ENSINO - FAE;UNIFAE;SP
219;FACULDADE DE EDUCAÇÃO CIÊNCIAS E ARTES DOM BOSCO DE MONTE APRAZÍVEL;FAECA DOM BOSCO;SP
220;FACULDADE SÃO JUDAS TADEU;FSJT;RJ
221;UNIVERSIDADE CRUZEIRO DO SUL;UNICSUL;SP
222;CENTRO UNIVERSITÁRIO DE VOTUPORANGA;UNIFEV;SP
224;FACULDADE DE MEDICINA DO ABC;FMABC;SP
225;INSTITUTO DE ENSINO SUPERIOR SANTO ANDRÉ;IESA;SP
226;CENTRO UNIVERSITÁRIO LUSÍADA;UNILUS;SP
227;UNIVERSIDADE CATÓLICA DE SANTOS;UNISANTOS;SP
231;FACULDADE DE SÃO BERNARDO DO CAMPO - FASB;FASB I;SP
234;FACULDADES OSWALDO CRUZ;FOC;SP
240;UNIVERSIDADE SANTA ÚRSULA;USU;RJ
242;CENTRO UNIVERSITÁRIO ANHANGUERA;UNIA;SP
243;FACULDADE DO CLUBE NÁUTICO MOGIANO;FCNM;SP
244;CENTRO UNIVERSITÁRIO FIEO;UNIFIEO;SP
254;CENTRO UNIVERSITÁRIO CAPITAL;UNICAPITAL;SP
255;FACULDADE DE ENGENHARIA E AGRIMENSURA DE PIRASSUNUNGA - FEAP;FEAP;SP
256;FACULDADE DE FILOSOFIA, CIÊNCIAS E LETRAS DE PIRAJU;FAFIP;SP
263;FACULDADES INTEGRADAS CAMPOS SALLES;FICS;SP
265;FACULDADES INTEGRADAS DE OURINHOS;FIO;SP
266;UNIVERSIDADE METODISTA DE PIRACICABA;UNIMEP;SP
267;FACULDADES INTEGRADAS ESPÍRITO SANTENSES;FAESA I;ES
268;FACULDADE DE DIREITO DA ALTA PAULISTA;FADAP;SP
269;FACULDADE FACCAT;FACCAT;SP
270;FACULDADES ESEFAP;;SP
271;UNIVERSIDADE DO OESTE PAULISTA;UNOESTE;SP
275;UNIVERSIDADE DO VALE DO PARAÍBA;UNIVAP;SP
276;FACULDADE DE DIREITO DE SOROCABA;FADI;SP
277;CENTRO UNIVERSITÁRIO AUGUSTO MOTTA;UNISUAM;RJ
278;FACULDADES INTEGRADAS SIMONSEN;FIS;RJ
279;FACULDADES INTEGRADAS HÉLIO ALONSO;FACHA;RJ
284;FACULDADE DE MEDICINA DE ITAJUBÁ;FMIT;MG
288;FACULDADE DE DIREITO DO VALE DO RIO DOCE;FADIVALE;MG
294;FACULDADE TRÊS DE MAIO;SETREM;RS
295;UNIVERSIDADE DE SANTA CRUZ DO SUL;UNISC;RS
296;UNIVERSIDADE DA REGIÃO DA CAMPANHA;URCAMP;RS
298;UNIVERSIDADE NORTE DO PARANÁ;UNOPAR;PR
299;FACULDADE DE JANDAIA DO SUL;FAFIJAN;PR
302;FACULDADE DE CIÊNCIAS ECONÔMICAS, ADMINISTRATIVAS E CONTÁBEIS DE DIVINÓPOLIS;FACED;MG
307;FACULDADE DE MEDICINA DE BARBACENA;FAME;MG
308;UNIVERSIDADE PRESIDENTE ANTÔNIO CARLOS;UNIPAC;MG
316;UNIVERSIDADE NOVE DE JULHO;UNINOVE;SP
319;UNIVERSIDADE CAMILO CASTELO BRANCO;UNICASTELO;SP
322;UNIVERSIDADE PAULISTA;UNIP;SP
330;UNIVERSIDADE IGUAÇU;UNIG;RJ
336;FACULDADE MACHADO SOBRINHO;FMS;MG
337;CENTRO DE ENSINO SUPERIOR DE JUIZ DE FORA;CES/JF;MG
338;PONTIFÍCIA UNIVERSIDADE CATÓLICA DE MINAS GERAIS;PUC MINAS;MG
339;FACULDADE SANTA EMÍLIA DE RODAT;FASER;PB
343;CENTRO UNIVERSITÁRIO NEWTON PAIVA;NEWTON PAIVA;MG
344;CENTRO UNIVERSITÁRIO UNA;UNA;MG
345;ESCOLA DE ENGENHARIA KENNEDY;EEK;MG
346;INSTITUTO SUPERIOR DE CIÊNCIAS APLICADAS - ISCA;ISCA;SP
349;CENTRO UNIVERSITÁRIO DE BELO HORIZONTE;UNI-BH;MG
351;FACULDADE DE CIÊNCIAS MÉDICAS DE MINAS GERAIS;FCMMG;MG
352;CENTRO UNIVERSITÁRIO DE JOÃO PESSOA;UNIPÊ;PB
353;FACULDADE EVANGÉLICA DO PARANÁ;FEPAR;PR
355;UNIVERSIDADE TUIUTI DO PARANÁ;UTP;PR
360;CENTRO UNIVERSITÁRIO PAULISTANO;UNIPAULISTANA;SP
361;FACULDADE PAULISTA DE SERVIÇO SOCIAL DE SÃO CAETANO DO SUL;FAPSS-SCS;SP
362;FACULDADE PAULISTA DE SERVIÇO SOCIAL;FAPSS-SP.;SP
363;FACULDADE MOZARTEUM DE SÃO PAULO;FAMOSP;SP
364;FACULDADE DE CIÊNCIAS CONTÁBEIS DE PONTE NOVA;FACE;MG
367;UNIVERSIDADE ESTADUAL DE MONTES CLAROS;UNIMONTES;MG
368;FACULDADE DE EDUCAÇÃO FÍSICA DA ASSOCIAÇÃO CRISTÃ DE MOÇOS DE SOROCABA;FEFISO;SP
370;FACULDADE PAULISTA DE ARTES;FPA;SP
371;FACULDADE DE MÚSICA CARLOS GOMES;FMCG;SP
372;FACULDADE DE BIBLIOTECONOMIA E CIÊNCIA DA INFORMAÇÃO;FABCI;SP
373;ESCOLA DE SOCIOLOGIA E POLÍTICA DE SÃO PAULO;ESP;SP
374;CENTRO UNIVERSITÁRIO DAS FACULDADES METROPOLITANAS UNIDAS;FMU;SP
375;UNIVERSIDADE DE SANTO AMARO;UNISA;SP
376;CENTRO UNIVERSITÁRIO ANHANGUERA DE SÃO PAULO;;SP
383;UNIVERSIDADE DA AMAZÔNIA;UNAMA;PA
384;CENTRO UNIVERSITÁRIO DE ANÁPOLIS;UNIEVANGÉLICA;GO
385;UNIVERSIDADE SALVADOR;UNIFACS;BA
386;CENTRO UNIVERSITÁRIO DE GOIÁS;UNI-ANHANGÜERA;GO
387;UNIVERSIDADE CATÓLICA DOM BOSCO;UCDB;MS
395;FACULDADE DE CIÊNCIAS CONTÁBEIS DE LUCÉLIA;CEALPA;SP
396;FACULDADE RUY BARBOSA;FRBA;BA
398;UNIVERSIDADE TIRADENTES;UNIT;SE
399;ESCOLA DE ENGENHARIA DE AGRIMENSURA;EEA;BA
402;CENTRO UNIVERSITÁRIO DE BRASÍLIA;UNICEUB;DF
403;UNIVERSIDADE CATÓLICA DE BRASÍLIA;UCB;DF
404;FACULDADES INTEGRADAS DA UPIS;UPIS;DF
405;FOCCA - FACULDADE DE OLINDA;FOCCA;PE
408;ESCOLA SUPERIOR DE RELAÇÕES PÚBLICAS;ESURP;PE
409;UNIVERSIDADE DE PERNAMBUCO;UPE;PE
410;FACULDADE DE CIÊNCIAS HUMANAS ESUDA;FCHE;PE
415;FACULDADE DE CIÊNCIAS MÉDICAS DA SANTA CASA SÃO PAULO;FCMSCSP;SP
416;FACULDADE DE SÃO PAULO;FATEMA;SP
417;UNIVERSIDADE CIDADE DE SÃO PAULO;;SP
420;UNIVERSIDADE DE MARÍLIA;UNIMAR;SP
421;FACULDADE ESTADUAL DE CIÊNCIAS E LETRAS DE CAMPO MOURÃO;FECILCAM;PR
423;UNIVERSIDADE REGIONAL INTEGRADA DO ALTO URUGUAI E DAS MISSÕES;URI;RS
426;CENTRO UNIVERSITÁRIO FRANCISCANO;UNIFRA;RS
430;CENTRO UNIVERSITÁRIO FILADÉLFIA;UNIFIL;PR
431;FACULDADE DE MEDICINA DE MARÍLIA;FAMEMA;SP
432;FACULDADE PARANAENSE;FACCAR;PR
434;FACULDADE SANTA MARCELINA;FASM;SP
435;FACULDADE DE FILOSOFIA CIÊNCIAS E LETRAS SANTA MARCELINA;FAFISM;MG
437;UNIVERSIDADE PARANAENSE;UNIPAR;PR
438;FACULDADE DE FILOSOFIA CIÊNCIAS E LETRAS DE ITUVERAVA;FFCL;SP
439;FACULDADE DOUTOR FRANCISCO MAEDA;FAFRAM;SP
440;FACULDADE DE DIREITO DE ITÚ;FADITU;SP
441;UNIVERSIDADE DO CONTESTADO;UNC;SC
446;UNIVERSIDADE DE CRUZ ALTA;UNICRUZ;RS
448;CENTRO UNIVERSITÁRIO RITTER DOS REIS;UNIRITTER;RS
449;UNIVERSIDADE LUTERANA DO BRASIL;ULBRA;RS
450;CENTRO UNIVERSITÁRIO LUTERANO DE JI-PARANÁ;CEULJI/ULBRA;RO
451;CENTRO UNIVERSITÁRIO LUTERANO DE SANTARÉM;CEULS;PA
452;CENTRO UNIVERSITÁRIO LUTERANO DE MANAUS;CEULM/ULBRA;AM
453;CENTRO UNIVERSITÁRIO LUTERANO DE PALMAS;CEULP;TO
454;FACULDADE CAMAQÜENSE DE CIÊNCIAS CONTÁBEIS E ADMINISTRATIVAS;FACCCA;RS
455;FACULDADE DE FORMAÇÃO DE PROFESSORES E ESPECIALISTAS DE EDUCAÇÃO;FAFOPEE;RS
456;CENTRO UNIVERSITÁRIO SANT´ANNA;UNISANT'ANNA;SP
457;UNIVERSIDADE BANDEIRANTE DE SÃO PAULO;UNIBAN;SP
458;UNIVERSIDADE IBIRAPUERA;UNIB;SP
460;FACULDADE DE ARTES PLÁSTICAS DA FUNDAÇÃO ARMANDO ALVARES PENTEADO;FAAP;SP
461;FACULDADE DE ADMINISTRAÇÃO DA FUNDAÇÃO ARMANDO ALVARES PENTEADO;FAE-FAAP;SP
462;FACULDADE DE ENGENHARIA DA FUNDAÇÃO ARMANDO ALVARES PENTEADO;FEFAAP;SP
463;FACULDADE DE COMUNICAÇÃO E MARKETING DA - FUNDAÇÃO ARMANDO ÁLVARES PENTEADO;FACOM-FAAP;SP
464;FACULDADE DE ECONOMIA DA FUNDAÇÃO ARMANDO ALVARES PENTEADO;FEC-FAAP;SP
465;FACULDADE DE COMPUTAÇÃO E INFORMÁTICA DA FUNDAÇÃO ARMANDO ALVARES PENTEADO;FCI-FAAP;SP
466;UNIVERSIDADE ANHEMBI MORUMBI;UAM;SP
467;FACULDADE DE CIÊNCIAS CONTÁBEIS DE ITAPETININGA;FCCI;SP
468;FACULDADE DE FILOSOFIA, CIÊNCIAS E LETRAS DE ITAPETININGA;FFCLI;SP
472;UNIVERSIDADE DO GRANDE RIO PROFESSOR JOSÉ DE SOUZA HERDY;UNIGRANRIO;RJ
473;FACULDADE DE CIÊNCIAS ECONÔMICAS, ADMINISTRATIVAS E DA COMPUTAÇÃO DOM BOSCO;FCEACDB;RJ
474;FACULDADE DE FILOSOFIA CIÊNCIAS E LETRAS DOM BOSCO;FFCLDB;RJ
475;FACULDADE DE MEDICINA DE PETRÓPOLIS;FMP;RJ
480;CENTRO UNIVERSITÁRIO SERRA DOS ÓRGÃOS;UNIFESO;RJ
481;UNIVERSIDADE GUARULHOS;UNG;SP
482;UNIVERSIDADE DO EXTREMO SUL CATARINENSE;UNESC;SC
483;CENTRO UNIVERSITÁRIO METROPOLITANO DE SÃO PAULO;UNIMESP;SP
489;CENTRO UNIVERSITÁRIO DE VOLTA REDONDA;UNIFOA;RJ
490;CENTRO DE ENSINO SUPERIOR DE VALENÇA;CESVA;RJ
491;FACULDADE DE EDUCAÇÃO CIÊNCIAS E LETRAS DON DOMÊNICO;FECLE;SP
492;FACULDADE DE ADMINISTRAÇÃO CIÊNCIAS ECON E CONTÁBEIS DE GUARATINGUETÁ;FACEAG;SP
493;FACULDADE DE EDUCAÇÃO DE GUARATINGUETÁ;FACEG;SP
494;UNIVERSIDADE DO SUL DE SANTA CATARINA;UNISUL;SC
495;FACULDADE DE CIÊNCIAS E LETRAS DE BRAGANÇA PAULISTA;FESB;SP
496;UNIVERSIDADE DE FRANCA;UNIFRAN;SP
501;ESCOLA SUPERIOR DE CIÊNCIAS DA SANTA CASA DE MISERICÓRDIA DE VITÓRIA;EMESCAM;ES
502;CENTRO UNIVERSITÁRIO MONTE SERRAT;UNIMONTE;SP
506;FACULDADE DE MEDICINA DE CAMPOS;FMC;RJ
507;FACULDADE TRIÂNGULO MINEIRO;FTM;MG
508;FACULDADE DE CIÊNCIAS SOCIAIS APLICADAS DO SUL DE MINAS - FACESM;FACESM;MG
509;FACULDADES INTEGRADAS DE CRUZEIRO;FIC;SP
510;ESCOLA DE ENFERMAGEM WENCESLAU BRAZ;EEWB;MG
513;UNIVERSIDADE VALE DO RIO DOCE;UNIVALE;MG
514;CENTRO UNIVERSITÁRIO DE BARRA MANSA;UBM;RJ
515;CENTRO UNIVERSITÁRIO PLÍNIO LEITE;UNIPLI;RJ
516;CENTRO UNIVERSITÁRIO MOACYR SREDER BASTOS;UNIMSB;RJ
517;FACULDADE DE EDUCAÇÃO SÃO LUÍS;FESL;SP
518;CENTRO UNIVERSITÁRIO DO DISTRITO FEDERAL;UDF;DF
519;UNIVERSIDADE CATÓLICA DO SALVADOR;UCSAL;BA
521;UNIVERSIDADE DE MOGI DAS CRUZES;UMC;SP
522;CENTRO UNIVERSITÁRIO CELSO LISBOA;UCL;RJ
526;UNIVERSIDADE BRAZ CUBAS;UBC;SP
527;PONTIFÍCIA UNIVERSIDADE CATÓLICA DE GOIÁS;PUC GOIÁS;GO
528;PONTIFÍCIA UNIVERSIDADE CATÓLICA DO RIO DE JANEIRO;PUC-RIO;RJ
530;FACULDADE DE MÚSICA DO ESPÍRITO SANTO;FAMES;ES
532;UNIVERSIDADE REGIONAL DO NOROESTE DO ESTADO DO RIO GRANDE DO SUL;UNIJUI;RS
533;FACULDADES INTEGRADAS DE ITAPETININGA;FII;SP
534;ESCOLA BAHIANA DE MEDICINA E SAÚDE PÚBLICA;EBMSP;BA
535;FACULDADE DE FILOSOFIA CIÊNCIAS E LETRAS DE MANDAGUARI;FAFIMAN;PR
543;FACULDADE DE CIÊNCIAS DA FUNDAÇÃO INSTITUTO TECNOLÓGICO DE OSASCO;FAC-FITO;SP
544;FACULDADE DE CIÊNCIAS HUMANAS DE ITABIRA;FACHI;MG
545;FACULDADE DE CIÊNCIAS ADMINISTRATIVAS E CONTÁBEIS DE ITABIRA;FACCI;MG
546;PONTIFÍCIA UNIVERSIDADE CATÓLICA DE SÃO PAULO;PUCSP;SP
547;UNIVERSIDADE DO ESTADO DO RIO DE JANEIRO;UERJ;RJ
548;UNIVERSIDADE FEDERAL DO MARANHÃO;UFMA;MA
549;UNIVERSIDADE FEDERAL DO ACRE;UFAC;AC
550;UNIVERSIDADE ESTADUAL DA PARAÍBA;UEPB;PB
555;UNIVERSIDADE DE FORTALEZA;UNIFOR;CE
556;CONSERVATÓRIO DE MÚSICA DE NITERÓI;CMN;RJ
557;ESCOLA DE MÚSICA E BELAS ARTES DO PARANÁ;EMBAP;PR
558;FACULDADE DE ARTES DO PARANÁ;FAP;PR
568;UNIVERSIDADE ESTADUAL DO MARANHÃO;UEMA;MA
569;UNIVERSIDADE FEDERAL DO PARÁ;UFPA;PA
570;UNIVERSIDADE FEDERAL DO RIO GRANDE DO NORTE;UFRN;RN
571;UNIVERSIDADE FEDERAL DO PARANÁ;UFPR;PR
572;UNIVERSIDADE FEDERAL FLUMINENSE;UFF;RJ
573;UNIVERSIDADE FEDERAL DO ESPÍRITO SANTO;UFES;ES
574;UNIVERSIDADE FEDERAL RURAL DO RIO DE JANEIRO;UFRRJ;RJ
575;UNIVERSIDADE FEDERAL DE MINAS GERAIS;UFMG;MG
576;UNIVERSIDADE FEDERAL DE JUIZ DE FORA;UFJF;MG
577;UNIVERSIDADE FEDERAL DE ALAGOAS;UFAL;AL
578;UNIVERSIDADE FEDERAL DA BAHIA;UFBA;BA
579;UNIVERSIDADE FEDERAL DA PARAÍBA;UFPB;PB
580;UNIVERSIDADE FEDERAL DE PERNAMBUCO;UFPE;PE
581;UNIVERSIDADE FEDERAL DO RIO GRANDE DO SUL;UFRGS;RS
582;UNIVERSIDADE FEDERAL DE SANTA MARIA;UFSM;RS
583;UNIVERSIDADE FEDERAL DO CEARÁ;UFC;CE
584;UNIVERSIDADE FEDERAL DE GOIÁS;UFG;GO
585;UNIVERSIDADE FEDERAL DE SANTA CATARINA;UFSC;SC
586;UNIVERSIDADE FEDERAL DO RIO DE JANEIRO;UFRJ;RJ
587;UNIVERSIDADE FEDERAL RURAL DE PERNAMBUCO;UFRPE;PE
588;UNIVERSIDADE TECNOLÓGICA FEDERAL DO PARANÁ;UTFPR;PR
589;UNIVERSIDADE FEDERAL RURAL DO SEMI-ÁRIDO;UFERSA;RN
590;UNIVERSIDADE FEDERAL RURAL DA AMAZÔNIA;UFRA;PA
591;UNIVERSIDADE FEDERAL DE SÃO PAULO;UNIFESP;SP
592;UNIVERSIDADE FEDERAL DE LAVRAS;UFLA;MG
593;CENTRO FEDERAL DE EDUCAÇÃO TECNOLÓGICA CELSO SUCKOW DA FONSECA;CEFET/RJ;RJ
594;CENTRO FEDERAL DE EDUCAÇÃO TECNOLÓGICA DE MINAS GERAIS;CEFET/MG;MG
595;UNIVERSIDADE FEDERAL DE ALFENAS;UNIFAL-MG;MG
596;UNIVERSIDADE FEDERAL DOS VALES DO JEQUITINHONHA E MUCURI;UFVJM;MG
597;UNIVERSIDADE FEDERAL DO TRIÂNGULO MINEIRO;UFTM;MG
598;UNIVERSIDADE FEDERAL DE ITAJUBÁ - UNIFEI;UNIFEI;MG
599;INSTITUTO FEDERAL DE EDUCAÇÃO, CIÊNCIA E TECNOLOGIA DA BAHIA;IFBA;BA
600;INSTITUTO FEDERAL DE EDUCAÇÃO, CIÊNCIA E TECNOLOGIA DO MARANHÃO;IFMA;MA
601;INSTITUTO FEDERAL DE EDUCAÇÃO, CIÊNCIA E TECNOLOGIA DO RIO GRANDE DO SUL;IFRS;RS
602;INSTITUTO TECNOLÓGICO DE AERONÁUTICA;ITA;SP
605;UNIVERSIDADE MUNICIPAL DE SÃO CAETANO DO SUL;USCS;SP
606;FACULDADE DE DIREITO DE CACHOEIRO DO ITAPEMIRIM;FDCI;ES
607;FACULDADE DE CIÊNCIAS CONTÁBEIS E ADMINISTRATIVAS DE CACHOEIRO DO ITAPEMIRIM;FACCACI;ES
608;"ESCOLA SUPERIOR DE CRUZEIRO ""PREFEITO HAMILTON VIEIRA MENDES""";ESEFIC;SP
609;UNIVERSIDADE ESTADUAL DO OESTE DO PARANÁ;UNIOESTE;PR
610;CENTRO UNIVERSITÁRIO METODISTA BENNETT;BENNETT;RJ
614;FACULDADE DE FILOSOFIA SANTA DOROTÉIA;FFSD;RJ
615;FACULDADE DE FILOSOFIA CIÊNCIAS E LETRAS PROFESSORA NAIR FORTES ABU-MERHY;FAFI - PRONAFOR;MG
621;CENTRO DE ESTUDOS SUPERIORES DE MACEIÓ;CESMAC;AL
622;FACULDADES INTEGRADAS SILVA E SOUZA;FAU;RJ
624;FACULDADE DE FILOSOFIA CIÊNCIAS E LETRAS CARLOS QUEIROZ;FAFIQUE;SP
625;FACULDADE CENECISTA DE CAPIVARI;FACECAP;SP
626;FACULDADE CENECISTA DE OSÓRIO;FACOS;RS
627;FACULDADE CENECISTA DE VARGINHA;FACECA;MG
631;CENTRO DE ENSINO SUPERIOR CENECISTA DE FARROUPILHA;CESF;RS
633;INSTITUTO MILITAR DE ENGENHARIA;IME;RJ
634;UNIVERSIDADE FEDERAL DE PELOTAS;UFPEL;RS
636;ESCOLA SUPERIOR DE PROPAGANDA E MARKETING;ESPM;SP
637;FACULDADE DE ENGENHARIA SÃO PAULO;FESP;SP
638;FACULDADE DE DIREITO MILTON CAMPOS;FDMC;MG
640;FACULDADES INTEGRADAS MARIA THEREZA;FAMATH;RJ
641;CENTRO UNIVERSITÁRIO LA SALLE;UNILASALLE;RS
645;CENTRO UNIVERSITÁRIO DE JARAGUÁ DO SUL;UNERJ;SC
647;FACULDADE DE ENFERMAGEM LUIZA DE MARILLAC;FELM;RJ
648;FACULDADES ASSOCIADAS DE UBERABA - FAZU;FAZU;MG
649;CENTRO UNIVERSITÁRIO DE UNIÃO DA VITÓRIA;UNIUV;PR
650;FACULDADE DE CIÊNCIAS CONTÁBEIS E ADMINISTRATIVAS DE AVARÉ;IESA/FACCAA;SP
651;FACULDADE DE ADMINISTRAÇÃO DE GOVERNADOR VALADARES;FAGV;MG
652;FACULDADE SANTA CECÍLIA;FASC;SP
657;FACULDADE DE FORMAÇÃO DE PROFESSORES DE SERRA TALHADA;FAFOPST;PE
662;FACULDADES INTEGRADAS CORAÇÃO DE JESUS;FAINC;SP
663;UNIVERSIDADE SALGADO DE OLIVEIRA;UNIVERSO;RJ
664;CENTRO UNIVERSITÁRIO VILA VELHA;UVV;ES
665;UNIVERSIDADE DE TAUBATÉ;UNITAU;SP
666;UNIVERSIDADE ESTADUAL DE FEIRA DE SANTANA;UEFS;BA
667;FACULDADES INTEGRADAS DE JACAREPAGUÁ;FIJ;RJ
668;CENTRO UNIVERSITÁRIO DE ENSINO SUPERIOR DO AMAZONAS;CIESA;AM
669;UNIVERSIDADE NILTON LINS;UNINILTONLINS;AM
670;UNIVERSIDADE SÃO FRANCISCO;USF;SP
671;UNIVERSIDADE ANHANGUERA - UNIDERP;UNIDERP;MS
672;FACULDADE DE ENGENHARIA DE SOROCABA;FACENS;SP
673;CENTRO UNIVERSITÁRIO DA GRANDE DOURADOS;UNIGRAN;MS
674;CENTRO DE ENSINO SUPERIOR DO VALE SÃO FRANCISCO;CESVASF;PE
677;FACULDADE DE REABILITAÇÃO DA ASCE;FRASCE;RJ
680;FACULDADES INTEGRADAS DE PEDRO LEOPOLDO;FIPEL;MG
682;FACULDADE DO NOROESTE DE MINAS;FINOM;MG
685;FACULDADE DE FORMAÇÃO DE PROFESSORES DE BELO JARDIM;FABEJA;PE
686;FACULDADE DE CIÊNCIAS APLICADAS DE LIMOEIRO;FACAL;PE
687;FACULDADE ESTADUAL DE FILOSOFIA CIÊNCIAS LETRAS UNIÃO DA VITÓRIA;FAFIUV;PR
688;UNIVERSIDADE ESTADUAL DO SUDOESTE DA BAHIA;UESB;BA
692;FACULDADE DE CIÊNCIAS APLICADAS E SOCIAIS DE PETROLINA;FACAPE;PE
693;UNIVERSIDADE FEDERAL DO ESTADO DO RIO DE JANEIRO;UNIRIO;RJ
694;UNIVERSIDADE FEDERAL DE MATO GROSSO DO SUL;UFMS;MS
699;FUNDAÇÃO UNIVERSIDADE FEDERAL DE RONDÔNIA;UNIR;RO
701;FACULDADE DE CIÊNCIAS DA ADMINISTRAÇÃO DE GARANHUNS;FAGA;PE
702;FACULDADE DE FORMAÇÃO DE PROFESSORES DE GOIANA;F.F.P.G.;PE
703;FACULDADE DE FORMAÇÃO DE PROFESSORES DE ARARIPINA;FAFOPA;PE
704;FACULDADE DE CIÊNCIAS AGRÁRIAS DE ARARIPINA;FACIAGRA;PE
705;FACULDADE SÃO JOSÉ;FSJ;RJ
706;FACULDADE DE ARTES DULCINA DE MORAES;FADM;DF
707;CENTRO UNIVERSITÁRIO CENTRAL PAULISTA;UNICEP;SP
710;FACULDADE BÉTHENCOURT DA SILVA;FABES;RJ
712;CENTRO UNIVERSITÁRIO HERMÍNIO DA SILVEIRA;UNI IBMR;RJ
715;CENTRO UNIVERSITÁRIO FRANCISCANO DO PARANÁ;FAE;PR
716;FACULDADES INTEGRADAS DE BOTUCATU;UNIFAC;SP
717;FUNDAÇÃO UNIVERSIDADE FEDERAL DE CIÊNCIAS DA SAÚDE DE PORTO ALEGRE;UFCSPA;RS
718;UNIVERSIDADE POTIGUAR;UNP;RN
719;UNIVERSIDADE DO ESTADO DE MATO GROSSO;UNEMAT;MT
720;FACULDADE DE CIÊNCIAS HUMANAS E SOCIAIS APLICADAS DO CABO DE SANTO AGOSTINHO;FACHUCA;PE
721;FACULDADE DE EDUCAÇÃO DE ASSIS;FAEDA;SP
722;ESCOLA DE EDUCAÇÃO FÍSICA DE ASSIS;EEFA;SP
723;FACULDADE DE ADMINISTRAÇÃO DE ASSIS;FAA;SP
724;FACULDADE DE CIÊNCIAS, CULTURA E EXTENSÃO DO RIO GRANDE DO NORTE;FACEX;RN
725;FACULDADE ESTADUAL DE FILOSOFIA, CIÊNCIAS E LETRAS DE PARANAGUÁ;FAFIPAR;PR
727;FACULDADE DE FILOSOFIA, CIÊNCIAS E LETRAS DO ALTO SÃO FRANCISCO;FASF;MG
728;FACULDADE DE CIÊNCIAS HUMANAS DE CURVELO;FACIC;MG
730;UNIVERSIDADE ESTADUAL DE PONTA GROSSA;UEPG;PR
734;FACULDADES INTEGRADAS MARIA IMACULADA;FIMI;SP
736;FACULDADE PITÁGORAS DE LINHARES;;ES
737;CENTRO UNIVERSITÁRIO SÃO CAMILO;SAO CAMILO;SP
738;FACULDADES INTEGRADAS TERESA D´ÁVILA;FATEA;SP
739;CENTRO UNIVERSITÁRIO SÃO CAMILO - ESPÍRITO SANTO;SÃO CAMILO-ES;ES
743;ESCOLA SUPERIOR DE ENSINO HELENA ANTIPOFF;ESEHA;RJ
744;FACULDADE DE EDUCAÇÃO E CIÊNCIAS HUMANAS DE ANICUNS;FECHA;GO
745;INSTITUTO MUNICIPAL DE ENSINO SUPERIOR DE SÃO MANUEL;IMESSM;SP
746;UNIVERSIDADE REGIONAL DO CARIRI;URCA;CE
749;CENTRO DE ENSINO SUPERIOR DO VALE DO PARNAÍBA;CESVALE;PI
750;CENTRO UNIVERSITÁRIO UNIRG;UNIRG;TO
752;FACULDADE DE PARÁ DE MINAS;FAPAM;MG
753;FACULDADE DE CIÊNCIAS HUMANAS DO SERTÃO CENTRAL;FACHUSC;PE
754;CENTRO DE ENSINO SUPERIOR DE CATALÃO;CESUC;GO
755;CENTRO DE ENSINO SUPERIOR DE JATAÍ;CESUT;GO
756;UNIVERSIDADE ESTADUAL DO PIAUÍ;UESPI;PI
757;FACULDADES INTEGRADAS DO TAPAJÓS;ISES;PA
759;FACULDADE DE CIÊNCIAS MÉDICAS E PARAMÉDICAS FLUMINENSE;SEFLU;RJ
760;FACULDADE DE CIÊNCIAS HUMANAS DE PERNAMBUCO;FCHPE;PE
761;FACULDADES SPEI;FACSPEI;PR
763;INSTITUTO UNIFICADO DE ENSINO SUPERIOR OBJETIVO;IUESO;GO
764;FACULDADE PINHEIRO GUIMARÃES;FAPG;RJ
769;FACULDADES INTEGRADAS DE NAVIRAÍ;FINAV;MS
774;FACULDADE ALVORADA DE INFORMÁTICA E PROCESSAMENTO DE DADOS;FAIPD;DF
775;FACULDADE ALVORADA DE EDUCAÇÃO FÍSICA E DESPORTO;FAEFD;DF
777;FACULDADE DE EDUCAÇÃO THEREZA PORTO MARQUES;FAETEC;SP
778;FACULDADE DE TECNOLOGIA THEREZA PORTO MARQUES;FAETEC;SP
779;FACULDADE DE PONTA PORÃ;FAP;MS
780;UNIVERSIDADE DE CUIABÁ;UNIC / PITÁGORAS;MT
781;FACULDADE ANHANGUERA DE RONDONÓPOLIS;FAR;MT
785;FACULDADE DE EDUCAÇÃO DE TANGARÁ DA SERRA;FACEDUTS;MT
788;FACULDADE DE RONDÔNIA;FARO;RO
789;UNIVERSIDADE FEDERAL DE RORAIMA;UFRR;RR
790;FACULDADE DE ENFERMAGEM DO HOSPITAL ISRAELITA ALBERT EINSTEIN;FEHIAE;SP
792;CENTRO UNIVERSITÁRIO DO ESTADO DO PARÁ;CESUPA;PA
793;Centro Universitário Estácio Radial de São Paulo - Estácio UNIRADIAL;RADIAL;SP
794;CENTRO UNIVERSITÁRIO DE VÁRZEA GRANDE;UNIVAG;MT
795;FACULDADES INTEGRADAS DE DIAMANTINO;FID;MT
796;FACULDADE DE CIÊNCIAS SOCIAIS APLICADAS DO VALE DO SÃO LOURENÇO;EDUVALE;MT
797;Faculdade AVEC de Vilhena;AVEC;RO
798;FACULDADE DE ARACRUZ;FAACZ;ES
801;FACULDADE MONTENEGRO;FAM;BA
802;CENTRO UNIVERSITÁRIO CARIOCA;UNICARIOCA;RJ
803;FACULDADE INTERAÇÃO AMERICANA;FIA;SP
809;FACULDADE DE DIREITO E CIÊNCIAS SOCIAIS DO LESTE DE MINAS - FADILESTE;FADILESTE;MG
810;CENTRO TÉCNICO-EDUCACIONAL SUPERIOR DO OESTE PARANAENSE;CTESOP;PR
811;FACULDADES INTEGRADAS DE CASSILÂNDIA;FIC;MS
822;ESCOLA SUPERIOR DE ESTUDOS EMPRESARIAIS E INFORMÁTICA;ESEEI;PR
823;CENTRO UNIVERSITÁRIO DO MARANHÃO;UNICEUMA;MA
824;FACULDADE DE FILOSOFIA E CIÊNCIAS HUMANAS DE GOIATUBA;FAFICH;GO
825;FACULDADE PRESBITERIANA GAMMON;FAGAMMON;MG
826;CENTRO UNIVERSITÁRIO DE DESENVOLVIMENTO DO CENTRO-OESTE;UNIDESC;GO
828;FACULDADE DE SÃO LOURENÇO;FASAMA;MG
829;UNIVERSIDADE DO TOCANTINS;UNITINS;TO
830;UNIVERSIDADE FEDERAL DO AMAPÁ;UNIFAP;AP
831;FACULDADE DE CIÊNCIAS HUMANAS DO VALE DO RIO GRANDE;FCHVRG;SP
832;FACULDADE DE CIÊNCIAS ADMINISTRATIVAS DE CURVELO;FACIAC;MG
833;FACULDADES INTEGRADAS DE ARIQUEMES;FIAR;RO
837;FACULDADE DE CIÊNCIAS HUMANAS DE FORTALEZA;FCHFOR;CE
838;FACULDADE DE CIÊNCIAS TECNOLÓGICAS DE FORTALEZA;FCTFOR;CE
839;FACULDADE VITORIANA DE CIÊNCIAS CONTÁBEIS;FAVI;ES
840;FACULDADE VITORIANA DE TECNOLOGIA;FAVI;ES
843;FACULDADE DE CIÊNCIAS E TECNOLOGIA DE BIRIGUI;FATEB;SP
844;FACULDADE DE AGRONOMIA E ENGENHARIA FLORESTAL DE GARÇA;FAEF;SP
845;FACULDADE DA FUNDAÇÃO EDUCACIONAL ARAÇATUBA;FAC-FEA;SP
846;FACULDADE DE ADMINISTRAÇÃO DE TERESINA;FAT;PI
