id;name;acronym;state
46082,79673;FACULDADE DE HORTOLÂNDIA;FACH;SP
46086,67119;ESCOLA DE GOVERNO PROFESSOR PAULO NEVES DE CARVALHO;EG;MG
46090,54565;FACULDADE ANHANGUERA DE BELO HORIZONTE;;MG
46094,42011;FACULDADE DE CIÊNCIAS ECONÔMICAS E ADMINISTRATIVAS SANTA RITA DE CÁSSIA;FACEAS;SP
46098,29457;FACULDADE DE CIÊNCIAS ADMINISTRATIVAS E DE TECNOLOGIA;FATEC;RO
46102,16902;FACULDADE ESCOLA PAULISTA DE DIREITO;FACEPD;SP
46106,04348;FACULDADE DE EDUCAÇÃO E CIÊNCIAS GERENCIAIS DE SUMARÉ;FECGS;SP
46109,91794;FACULDADE DE EDUCAÇÃO E CIÊNCIAS GERENCIAIS DE INDAIATUBA;FECGI;SP
46113,7924;FACULDADE ALAGOANA DE ADMINISTRAÇÃO;FAA;AL
46117,66686;FACULDADE DE BELFORD ROXO;FABEL;RJ
46121,54132;FACULDADE SANTA LÚCIA;FCACSL;SP
46125,41578;FACULDADES INTEGRADAS DE PARANAÍBA - FIPAR;FIPAR;MS
46129,29024;FACULDADE DE ADMINISTRAÇÃO DE FÁTIMA DO SUL;FAFS;MS
46133,16469;FACULDADE DE CIÊNCIAS, SAÚDE, EXATAS E JURÍDICAS DE TERESINA;FACULDADE CEUT;PI
46137,03915;FACULDADE DE CIÊNCIAS CONTÁBEIS DE NAVIRAI;FACINAV;MS
46140,91361;FACULDADE DE CIÊNCIAS SOCIAIS APLICADAS DE CASCAVEL;FCSAC;PR
46144,78807;FACULDADE REGES DE DRACENA;FCGD;SP
46148,66253;FACULDADE DE ADMINISTRAÇÃO E CIÊNCIAS CONTÁBEIS DE SÃO ROQUE;FACCSR;SP
46152,53699;FACULDADE INTERLAGOS DE EDUCAÇÃO E CULTURA;FINTEC;SP
46156,41145;CENTRO UNIVERSITÁRIO ANHANGUERA DE CAMPO GRANDE;;MS
46160,28591;FACULDADE CATÓLICA DE ANÁPOLIS;CATÓLICA DE ANÁPOLIS;GO
46164,16036;Faculdades Magsul;FAMAG;MS
46168,03482;ESCOLA SUPERIOR DE PROPAGANDA E MARKETING DO RIO DE JANEIRO;ESPM;RJ
46171,90928;INSTITUTO DE CIÊNCIAS SOCIAIS E HUMANAS;INCISOH;MG
46175,78374;UNIÃO DE ENSINO SUPERIOR DE NOVA MUTUM;UNINOVA;MT
46179,6582;UNIVERSIDADE SANTA CECÍLIA;UNISANTA;SP
46183,53266;UNIVERSIDADE METROPOLITANA DE SANTOS;UNIMES;SP
46187,40712;FACULDADE DE FILOSOFIA CIÊNCIAS E LETRAS;FAFIL;PB
46191,28158;FACULDADE DE TECNOLOGIA DE TAQUARITINGA;FATEC/TQ;SP
46195,15603;FACULDADE DE LUCÉLIA;;SP
46199,03049;FACULDADES INTEGRADAS DE PONTA PORÃ;FIP;MS
46202,90495;FACULDADE SÃO CAMILO;;BA
46206,77941;FACULDADE PRUDENTE DE MORAES;FPM;SP
46210,65387;FACULDADE DE CIÊNCIAS E EDUCAÇÃO DE RUBIATABA;FACER;GO
46214,52833;FACULDADE DE EDUCAÇÃO E CULTURA MONTESSORI;FAMEC;SP
46218,40279;ESCOLA SUPERIOR EM MEIO AMBIENTE;ESMA;MG
46222,27725;FACULDADE DE FILOSOFIA CIÊNCIAS E LETRAS DE CONGONHAS;FAFIC;MG
46226,1517;FACULDADE SENAI-CETIQT;SENAI-CETIQT;RJ
46230,02616;FACULDADE FLAMA;;RJ
46233,90062;Centro Universitário de Bauru;;SP
46237,77508;FACULDADE DE FORMAÇÃO DE PROFESSORES DE AFOGADOS DA INGAZEIRA;FAFOPAI;PE
46241,64954;FACULDADE SUDOESTE PAULISTANO;FASUP;SP
46245,524;INSTITUTO SUPERIOR E CENTRO EDUCACIONAL LUTERANO - BOM JESUS - IELUSC;BOM JESUS/IELUSC;SC
46249,39846;FACULDADE DE CIÊNCIAS E TECNOLOGIA DE UNAÍ - FACTU;FACTU;MG
46253,27292;FACULDADE DE CIÊNCIAS DE TIMBAÚBA;FACET;PE
46257,14737;UNIVERSIDADE ESTADUAL DO NORTE FLUMINENSE DARCY RIBEIRO;UENF;RJ
46261,02183;UNIVERSIDADE ESTADUAL DE MATO GROSSO DO SUL;UEMS;MS
46264,89629;FACULDADE DE ECONOMIA E FINANÇAS IBMEC;FACULDADES IBMEC;RJ
46268,77075;CENTRO UNIVERSITÁRIO SALESIANO DE SÃO PAULO;UNISAL;SP
46272,64521;UNIÃO DE ESCOLAS SUPERIORES DA FUNESO;UNESF;PE
46276,51967;UNIVERSIDADE DO ESTADO DE MINAS GERAIS;UEMG;MG
46280,39413;FACULDADES INTEGRADAS DE TRÊS LAGOAS;AEMS;MS
46284,26859;CENTRO UNIVERSITÁRIO UNIVATES;UNIVATES;RS
46288,14304;UNIVERSIDADE POSITIVO;UP;PR
46292,0175;CENTRO UNIVERSITÁRIO HERMINIO OMETTO DE ARARAS;UNIARARAS;SP
46295,89196;CENTRO UNIVERSITÁRIO ANHANGÜERA;UNIFIAN;SP
46299,76642;UNIÃO DAS FACULDADES DOS GRANDES LAGOS - UNILAGO;UNILAGO;SP
46303,64088;FACULDADE CAMPOS ELÍSEOS;FCE;SP
46307,51534;INSTITUTO DE ENSINO SUPERIOR FUCAPI;CESF;AM
46311,3898;FACULDADE DE CIÊNCIAS CONTÁBEIS - MACEIÓ;SEUNE;AL
46315,26426;FACULDADE DE TECNOLOGIA E CIÊNCIAS DE FEIRA DE SANTANA;FTC;BA
46319,13871;FACULDADE MAURÍCIO DE NASSAU DE SALVADOR;FMN SALVADOR;BA
46323,01317;Centro Universitário Estácio da Bahia - Estácio FIB;FIB;BA
46326,88763;FACULDADE LOURENÇO FILHO;FLF;CE
46330,76209;CENTRO UNIVERSITÁRIO DO INSTITUTO DE EDUCAÇÃO SUPERIOR DE BRASÍLIA - IESB;IESB;DF
46334,63655;FACULDADE BATISTA DE VILA VELHA;FABAVI;ES
46338,51101;FACULDADE BATISTA DE VITÓRIA;FABAVI;ES
46342,38547;FACULDADE DE CIÊNCIAS ECONÔMICAS E ADMINISTRATIVAS DE VILA VELHA;;ES
46346,25993;INSTITUTO DE ENSINO E PESQUISA OBJETIVO;IEPO;TO
46350,13438;FACULDADE DE JUSSARA;FAJ;GO
46354,00884;FACULDADE ALDETE MARIA ALVES;FAMA;MG
46357,8833;INSTITUTO DE ENSINO SUPERIOR CENECISTA;INESC;MG
46361,75776;INSTITUTO DE ENSINO SUPERIOR DA FUNLEC;IESF;MS
46365,63222;FACULDADE AFIRMATIVO;FAFI;MT
46369,50668;INSTITUTO DE EDUCAÇÃO SUPERIOR DA PARAÍBA;IESP;PB
46373,38114;FACULDADE DE FILOSOFIA, CIÊNCIAS E LETRAS DE CAJAZEIRAS;FAFIC;PB
46377,2556;Faculdade Estácio do Recife - Estácio FIR;FIR;PE
46381,13006;FACULDADE INTEGRADO DE CAMPO MOURÃO;CEI;PR
46385,00451;FACULDADE MARINGÁ;CESPAR;PR
46388,87897;FACULDADE ARTHUR SÁ EARP NETO;FASE;RJ
46392,75343;FACULDADE DE ENGENHARIA DE RESENDE;FER;RJ
46396,62789;INSTITUTO FEDERAL DE EDUCAÇÃO, CIÊNCIA E TECNOLOGIA DO RIO GRANDE DO NORTE;IFRN;RN
46400,50235;FACULDADE CENECISTA DE BENTO GONÇALVES;FACEBG;RS
46404,37681;FACULDADE METODISTA DE SANTA MARIA;FAMES;RS
46408,25127;FACULDADE DE EDUCAÇÃO DE COLORADO DO OESTE;FAEC;RO
46412,12573;FACULDADES INTEGRADAS APARÍCIO CARVALHO;FIMCA;RO
46416,00018;FACULDADE SÃO LUÍS DE FRANÇA;FSLF;SE
46419,87464;FACULDADES INTEGRADAS DE BAURU;FIB;SP
46423,7491;FACULDADE DE CIÊNCIAS JURÍDICAS E GERENCIAIS DE GARÇA;FAEG;SP
46427,62356;FACULDADE DE PRESIDENTE EPITÁCIO - FAPE;FAPE;SP
46431,49802;FACULDADES INTEGRADAS DE SÃO PAULO;FISP;SP
46435,37248;FACULDADE DE EDUCAÇÃO E CIÊNCIAS GERENCIAIS DE SÃO PAULO;FECG-SP;SP
46439,24694;FACULDADE CARLOS DRUMMOND DE ANDRADE;FCDA;SP
46443,1214;FACULDADE DE ADMINISTRAÇÃO SÃO PAULO;FAPI;SP
46446,99585;Faculdade Estácio do Ceará - Estácio FIC;FIC;CE
46450,87031;CENTRO UNIVERSITÁRIO EURO-AMERICANO;UNIEURO;DF
46454,74477;FACULDADE SANTA TEREZINHA;CEST;MA
46458,61923;UNIÃO DAS ESCOLAS DO GRUPO FAIMI DE EDUCAÇÃO;FAIMI;SP
46462,49369;INSTITUTO FEDERAL DE EDUCAÇÃO, CIÊNCIA E TECNOLOGIA FLUMINENSE;IF Fluminense;RJ
46466,36815;FACULDADE OSVALDO CRUZ;;SP
46470,24261;INSTITUTO DE EDUCAÇÃO SUPERIOR UNYAHNA DE SALVADOR;IESUS;BA
46474,11707;INSTITUTO DE EDUCAÇÃO SUPERIOR UNYAHNA DE BARREIRAS;IESUB;BA
46477,99152;FACULDADES INTEGRADAS ESPÍRITA;FIES;PR
46481,86598;UNIVERSIDADE ESTADUAL DO CENTRO OESTE;UNICENTRO;PR
46485,74044;UNIVERSIDADE DE ITAÚNA;UI;MG
46489,6149;CENTRO UNIVERSITÁRIO DO NORTE PAULISTA;UNORP;SP
46493,48936;FACULDADE METODISTA DE CIÊNCIAS HUMANAS E EXATAS;METODISTA;SP
46497,36382;FACULDADE SANTO AGOSTINHO;FSA;PI
46501,23828;FACULDADE DE CIÊNCIAS HUMANAS E SOCIAIS DE IGARASSU;FACIG;PE
46505,11274;FACULDADE DE ESTUDOS ADMINISTRATIVOS DE MINAS GERAIS - FEAD-MG;FEAD - MG;MG
46508,98719;FACULDADE GAMA E SOUZA;FGS;RJ
46512,86165;FACULDADES INTEGRADAS DE VITÓRIA;FDV;ES
46516,73611;FACULDADE DE EDUCAÇÃO SUPERIOR DE TIMBAÚBA;FAEST;PE
46520,61057;FACULDADE DE CIÊNCIAS HUMANAS;IMENSU;SP
46524,48503;CENTRO UNIVERSITÁRIO NOSSA SENHORA DO PATROCÍNIO;CEUNSP;SP
46528,35949;FACULDADE SENAI DE TECNOLOGIA GRÁFICA;SP SENAI;SP
46532,23395;FACULDADE DE ADMINISTRAÇÃO E NEGÓCIOS DE SERGIPE;FANESE;SE
46536,10841;UNIVERSIDADE CÂNDIDO MENDES;UCAM;RJ
46539,98286;FACULDADE SALESIANA DE SANTA TERESA;FSST;MS
46543,85732;FACULDADE CENECISTA DE ITABORAÍ;FACNEC;RJ
46547,73178;ESCOLA SUPERIOR SÃO FRANCISCO DE ASSIS;ESFA;ES
46551,60624;CENTRO DE ENSINO SUPERIOR DE VITÓRIA;CESV;ES
46555,4807;FACULDADE CAMBURY;CAMBURY;GO
46559,35516;INSPER INSTITUTO DE ENSINO E PESQUISA;INSPER;SP
46563,22962;FACULDADE DE ALTA FLORESTA;FAF;MT
46567,10408;INSTITUTO FEDERAL DE EDUCAÇÃO, CIÊNCIA E TECNOLOGIA  DA PARAÍBA;IFPB;PB
46570,97853;FACULDADE METROPOLITANA DE CAMAÇARI;FAMEC;BA
46574,85299;FACULDADE ANHANGUERA DE BRASÍLIA;FAB;DF
46578,72745;FACULDADE DE SABARÁ;SOECS;MG
46582,60191;FACULDADES RIOGRANDENSES;FARGS;RS
46586,47637;FACULDADE BRASÍLIA DE SÃO PAULO;FABRASP;SP
46590,35083;INSTITUTO DE ENSINO SUPERIOR DE AMERICANA;IESA;SP
46594,22529;CENTRO UNIVERSITÁRIO JORGE AMADO;UNIJORGE;BA
46598,09975;CENTRO UNIVERSITÁRIO MÓDULO;MÓDULO;SP
46601,9742;UNIVERSIDADE DO PLANALTO CATARINENSE;UNIPLAC;SC
46605,84866;FACULDADE INTEGRAL CANTAREIRA;F.I.C.;SP
46609,72312;INSTITUTO DE ENSINO SUPERIOR DE FORTALEZA;IESF;CE
46613,59758;FACULDADE DE CIÊNCIAS DA SAÚDE DE SÃO PAULO;FACIS;SP
46617,47204;FACULDADE DE TECNOLOGIA DE PONTA PORÃ;FATEP;MS
46621,3465;FACULDADE SENAI DE TECNOLOGIA MECATRÔNICA;SENAI;SP
46625,22096;CENTRO UNIVERSITÁRIO DE MARINGÁ - CEUMAR;CESUMAR;PR
46629,09542;FACULDADE DE CIÊNCIAS SOCIAIS E APLICADAS DO PARANÁ;FACET;PR
46632,96988;FACULDADE DE ADMINISTRAÇÃO MILTON CAMPOS;FAMC;MG
46636,84433;FACULDADE SANTA RITA;FASAR;MG
46640,71879;FACULDADE DE AMAMBAI;FIAMA;MS
46644,59325;FACULDADE EDUCACIONAL DA LAPA;FAEL;PR
46648,46771;FACULDADE DE NATAL;FAL;RN
46652,34217;FACULDADE DE CIÊNCIAS CONTÁBEIS DE ASSIS;FCCA;SP
46656,21663;FACULDADE FLEMING;SEF;SP
46660,09109;INSTITUTO ITAPETININGANO DE ENSINO SUPERIOR;IIES;SP
46663,96555;FACULDADE GAMMON;;SP
46667,84;CENTRO UNIVERSITÁRIO DE JALES;UNIJALES;SP
46671,71446;CENTRO UNIVERSITÁRIO AMPARENSE;UNIFIA;SP
46675,58892;INSTITUTO DE ENSINO SUPERIOR DO ACRE;IESACRE;AC
46679,46338;FACULDADE SÃO FRANCISCO DE BARREIRAS - FASB;FASB;BA
46683,33784;CENTRO REGIONAL UNIVERSITÁRIO DE ESPÍRITO SANTO DO PINHAL;UNIPINHAL;SP
46687,2123;INSTITUTO CENECISTA DE ENSINO SUPERIOR DE SANTO ÂNGELO;CNEC/IESA;RS
46691,08676;CENTRO UNIVERSITÁRIO CAMPOS DE ANDRADE;UNIANDRADE;PR
46694,96122;CENTRO UNIVERSITÁRIO CÂNDIDO RONDON;UNIRONDON;MT
46698,83567;FACULDADE NOSSA SENHORA APARECIDA;FANAP;GO
46702,71013;FACULDADE PADRÃO;PADRAO;GO
46706,58459;FACULDADE DE ESTUDOS SOCIAIS DO ESPÍRITO SANTO;PIO XII;ES
46710,45905;FACULDADE DE ADMINISTRAÇÃO DA SERRA;FABAVI;ES
46714,33351;FACULDADE BRASILEIRA;;ES
46718,20797;FACULDADE DE CASTELO;FACASTELO;ES
46722,08243;FACULDADE CANDIDO MENDES DE VITÓRIA;FCMV;ES
46725,95689;FACULDADE DE CIÊNCIAS CONTÁBEIS DE NOVA ANDRADINA - FACINAN;FACINAN;MS
46729,83134;FACULDADE DE PEDAGOGIA;ANAEC;MS
46733,7058;FACULDADE DE EDUCAÇÃO DE COSTA RICA;FECRA;MS
46737,58026;FACULDADE PROMOVE DE MINAS GERAIS;PROMOVE;MG
46741,45472;FACULDADE METODISTA GRANBERY;FMG;MG
46745,32918;FACULDADE DE ADMINISTRAÇÃO DE ITABIRITO;FAI;MG
46749,20364;FACULDADE BOA VIAGEM;FBV;PE
46753,0781;FACULDADE DOM BOSCO;DOM BOSCO;PR
46756,95256;FACULDADE DE ADMINISTRAÇÃO, CIÊNCIAS, EDUCAÇÃO E LETRAS;FACEL;PR
46760,82701;FACULDADE DE CIÊNCIAS APLICADAS DE CASCAVEL;FACIAP;PR
46764,70147;FACULDADE BEZERRA DE ARAÚJO;FABA;RJ
46768,57593;FACULDADE NATALENSE PARA O DESENVOLVIMENTO DO RIO GRANDE DO NORTE;FARN;RN
46772,45039;FACULDADES INTEGRADAS URUBUPUNGÁ;FIU;SP
46776,32485;INSTITUTO DE ENSINO SUPERIOR DA GRANDE FLORIANÓPOLIS;IESGF;SC
46780,19931;CENTRO UNIVERSITÁRIO DO INSTITUTO DE ENSINO SUPERIOR COC;COC;SP
46784,07377;FACULDADE SANT´ANNA DE SALTO;FASAS;SP
46787,94823;FACULDADE CAMPO LIMPO PAULISTA;FACCAMP;SP
46791,82268;FACULDADE DO GUARUJÁ;FAGU;SP
46795,69714;INSTITUTO TAUBATÉ DE ENSINO SUPERIOR;I.T.E.S.;SP
46799,5716;FACULDADE DE ITÁPOLIS - FACITA;FACITA;SP
46803,44606;Faculdade Estácio Cotia - Estácio FAAC;IESC;SP
46807,32052;FACULDADE DE CIÊNCIAS SOCIAIS E AGRÁRIAS DE ITAPEVA;FAIT;SP
46811,19498;INSTITUTO MANCHESTER PAULISTA DE ENSINO SUPERIOR;IMAPES;SP
46815,06944;FACULDADE SENAI DE TECNOLOGIA AMBIENTAL;SENAI;SP
46818,9439;FACULDADE DE DIREITO DA FUNDAÇÃO ARMANDO ALVARES PENTEADO;FAD-FAAP;SP
46822,81835;FACULDADE ALBERT EINSTEIN DE SÃO PAULO;FAESP;SP
46826,69281;FACULDADE DO NORTE PIONEIRO;FANORPI;PR
46830,56727;FACULDADES ADAMANTINENSES INTEGRADAS;FAI;SP
46834,44173;FACULDADE DAS AMÉRICAS;FAM;SP
46838,31619;FACULDADE MORUMBI SUL;FMS;SP
46842,19065;ESCOLA SUPERIOR DE MARKETING;ESM;PE
46846,06511;Faculdade Estácio de Alagoas - Estácio FAL;FAL;AL
46849,93957;FACULDADES INTEGRADAS DE FERNANDÓPOLIS;FIFE;SP
46853,81402;INSTITUTO TAQUARITINGUENSE DE ENSINO SUPERIOR DR. ARISTIDES DE CARVALHO SCHLOBACH;ITES;SP
46857,68848;INSTITUTO MATONENSE MUNICIPAL DE ENSINO SUPERIOR;IMMES;SP
46861,56294;FACULDADE BATISTA BRASILEIRA;FBB;BA
46865,4374;INSTITUTO FEDERAL DE EDUCAÇÃO, CIÊNCIA E TECNOLOGIA GOIANO;IF Goiano;GO
46869,31186;FACULDADES INTEGRADAS DE RIBEIRÃO PIRES;FIRP;SP
46873,18632;FACULDADE DE CIÊNCIAS JURÍDICAS, GERENCIAIS E EDUCAÇÃO DE SINOP;FIS;MT
46877,06078;FACULDADE DE CIÊNCIAS HUMANAS DE GARÇA;FAHU;SP
46880,93524;FACULDADE NOVO MILÊNIO;FNM;ES
46884,80969;FACULDADE JESUS MARIA JOSÉ;FAJESU;DF
46888,68415;FACULDADE DE AMERICANA;FAM;SP
46892,55861;TREVISAN ESCOLA SUPERIOR DE NEGÓCIOS;TREVISAN;SP
46896,43307;FACULDADES INTEGRADAS DE RONDONÓPOLIS;UNIR;MT
46900,30753;FACULDADE UNIDA DE SUZANO;UNISUZ;SP
46904,18199;INSTITUTO DE ENSINO SUPERIOR JOÃO ALFREDO DE ANDRADE;IJAA;MG
46908,05645;FACULDADE DE EDUCAÇÃO DA SERRA;FASE;ES
46911,93091;FACULDADE SUDOESTE PAULISTA;FSP;SP
46915,80537;FACULDADE JUVÊNCIO TERRA;FJT;BA
46919,67982;FACULDADE TECSOMA;FATEC;MG
46923,55428;FACULDADE EDUVALE DE AVARÉ;EDUVALE;SP
46927,42874;FACULDADE DE INFORMÁTICA LEMOS DE CASTRO;FILC;RJ
46931,3032;FACULDADE DE APUCARANA;FAP;PR
46935,17766;ESCOLA SUPERIOR DE ENSINO ANÍSIO TEIXEIRA;CESAT;ES
46939,05212;ESCOLA SUPERIOR DE PROPAGANDA E MARKETING DE PORTO ALEGRE;ESPM - POA;RS
46942,92658;FACULDADE DE COMUNICAÇÃO E TURISMO DE OLINDA;FACOTTUR;PE
46946,80104;FACULDADE COTEMIG;COTEMIG;MG
46950,67549;FACULDADE CECAP DO LAGO NORTE;CECAP;DF
46954,54995;FACULDADE DE CIÊNCIAS SOCIAIS APLICADAS - FACISA;FACISA;PB
46958,42441;INSTITUTO DE ENSINO SUPERIOR THATHI;FACULDADE THATHI COC;SP
46962,29887;FACULDADE ASSIS GURGACZ;FAG;PR
46966,17333;FACULDADE MATER DEI;FMD;PR
46970,04779;FACULDADE DE PEDAGOGIA DA SERRA;FABAVI;ES
46973,92225;FACULDADE BORGES DE MENDONÇA;FBM;SC
46977,79671;FACULDADE ANHANGUERA DE OSASCO;FIZO;SP
46981,67116;FACULDADE BATISTA DE MINAS GERAIS;FBMG;MG
46985,54562;FACULDADE DO VALE DO JAGUARIBE;FVJ;CE
46989,42008;INSTITUTO SUPERIOR TUPY - IST;IST;SC
46993,29454;INSTITUTO DE ENSINO SUPERIOR DE GARÇA;IESG;SP
46997,169;FACULDADES INTEGRADAS DE JAHU;FIJ;SP
47001,04346;FACULDADES INTEGRADAS DE SANTA FÉ DO SUL;FUNEC;SP
47004,91792;INSTITUTO SUPERIOR DE EDUCAÇÃO DO RIO DE JANEIRO;ISERJ;RJ
47008,79238;FACULDADE DE PEDAGOGIA DE AFONSO CLÁUDIO;ISEAC;ES
47012,66683;FACULDADE CAPIXABA DE NOVA VENÉCIA;;ES
47016,54129;FACULDADE SÃO GABRIEL;FSG;PI
47020,41575;FACULDADE UBAENSE OZANAM COELHO;FAGOC;MG
47024,29021;FACULDADE VISCONDE DE CAIRÚ;FAVIC;BA
47028,16467;FACULDADE DE TECNOLOGIA E CIÊNCIAS DE VITÓRIA DA CONQUISTA;FTC;BA
47032,03913;CENTRO UNIVERSITÁRIO ADVENTISTA DE SÃO PAULO;UNASP;SP
47035,91359;FACULDADE BARDDAL;FB-SI;SC
47039,78805;FACULDADE DE MIRANDÓPOLIS;FAM;SP
47043,6625;FACULDADE CASA BRANCA;FACAB;SP
47047,53696;FACULDADE DE CIÊNCIAS SOCIAIS DE GUARANTÃ DO NORTE;FCSGN;MT
47051,41142;FACULDADE CATÓLICA RAINHA DA PAZ DE ARAPUTANGA;FCARP;MT
47055,28588;FACULDADES INTEGRADAS SÃO PEDRO;FAESA;ES
47059,16034;FACULDADE MARTHA FALCÃO;FMF;AM
47063,0348;ESCOLA SUPERIOR DE TEOLOGIA;EST;RS
47066,90926;FACULDADE JOSÉ LACERDA FILHO DE CIÊNCIAS APLICADAS;FAJOLCA;PE
47070,78372;FACULDADE SANTA HELENA;FSH;PE
47074,65817;FACULDADES INTEGRADAS IPEP;FIPEP;SP
47078,53263;ESCOLA SUPERIOR DE ADMINISTRAÇÃO, MARKETING E COMUNICAÇÃO DE CAMPINAS - ESAMC CAMPINAS;ESAMC DE CAMPINAS;SP
47082,40709;FACULDADE SUMARÉ;ISES;SP
47086,28155;FACULDADE CASTRO ALVES;FCA;BA
47090,15601;FACULDADE DE CALDAS NOVAS;UNICALDAS;GO
47094,03047;FACULDADE DINÂMICA DAS CATARATAS;UDC;PR
47097,90493;FACULDADE UNISSA DE SARANDI;UNISSA;PR
47101,77939;FACULDADE METROPOLITANA DE CURITIBA;FAMEC;PR
47105,65384;FACULDADE ADELMAR ROSADO;FAR;PI
47109,5283;INSTITUTO DE CIÊNCIAS SOCIAIS E HUMANAS;ICSH;GO
47113,40276;FACULDADE DE PIMENTA BUENO;FAP;RO
47117,27722;FACULDADE DE PIRACANJUBA;FAP;GO
47121,15168;FACULDADE DO CENTRO LESTE;UCL;ES
47125,02614;ÁREA1 - FACULDADE DE CIÊNCIA E TECNOLOGIA;ÁREA6;BA
47128,9006;FACULDADE DOIS DE JULHO;F2J;BA
47132,77506;FACULDADE ANHAGUERA DE JUNDIAÍ;;SP
47136,64951;FACULDADE DE PRIMAVERA;CESPRI;SP
47140,52397;FACULDADE SÃO LUCAS;FSL;RO
47144,39843;FACULDADE MAGISTER;MAGISTER;SP
47148,27289;FACULDADE CENECISTA DE CAMPO LARGO;FACECLA;PR
47152,14735;CENTRO UNIVERSITÁRIO TOLEDO;UNITOLEDO;SP
47156,02181;CENTRO UNIVERSITÁRIO CURITIBA;UNICURITIBA;PR
47159,89627;FACULDADES DE DRACENA;;SP
47163,77073;CENTRO UNIVERSITÁRIO DO NORTE;UNINORTE;AM
47167,64519;FACULDADE IDEAL;FACI;PA
47171,51964;INSTITUTO LUTERANO DE ENSINO SUPERIOR DE ITUMBIARA;ILES;GO
47175,3941;FACULDADE DA SERRA GAÚCHA;FSG;RS
47179,26856;INSTITUTO DE ENSINO SUPERIOR PLANALTO;IESPLAN;DF
47183,14302;FACULDADE BATISTA DO RIO DE JANEIRO;FABAT;RJ
47187,01748;FACULDADE INGÁ;;PR
47190,89194;FACULDADE BERTIOGA;FABE;SP
47194,7664;FACULDADE ORÍGENES LESSA;FACOL;SP
47198,64086;INSTITUTO DE ENSINO SUPERIOR DE ITAPIRA;IESI;SP
47202,51531;FACULDADE DE VILA VELHA;;ES
47206,38977;ESCOLA SUPERIOR BATISTA DO AMAZONAS;ESBAM;AM
47210,26423;ESCOLA SUPERIOR DE TECNOLOGIA E EDUCAÇÃO DE RIO CLARO;ESRC;SP
47214,13869;FACULDADE DE ADMINISTRAÇÃO DE EMPRESAS;FACAMP;SP
47218,01315;FACULDADE DE CIÊNCIAS ECONÔMICAS;FACAMP;SP
47221,88761;INSTITUTO APHONSIANO DE ENSINO SUPERIOR;IAESUP;GO
47225,76207;FACULDADE DE TECNOLOGIA DO PIAUÍ;FATEPI;PI
47229,63653;FACULDADE DE DIREITO DE TANGARÁ DA SERRA;UNIC;MT
47233,51098;FACULDADE NACIONAL;FINAC;ES
47237,38544;FACULDADES INTEGRADAS EINSTEIN DE LIMEIRA;FIEL;SP
47241,2599;CENTRO UNIVERSITÁRIO DO INSTITUTO MAUÁ DE TECNOLOGIA;CEUN-IMT;SP
47245,13436;CENTRO UNIVERSITÁRIO PLANALTO DO DISTRITO FEDERAL - UNIPLAN;UNIPLAN;DF
47249,00882;FACULDADE DE EDUCAÇÃO, ADMINISTRAÇÃO E TECNOLOGIA DE IBAITI;FEATI;PR
47252,88328;CENTRO UNIVERSITÁRIO DO CERRADO-PATROCÍNIO;UNICERP;MG
47256,75774;FACULDADES INTEGRADAS DE SÃO CARLOS;FADISC;SP
47260,6322;FACULDADE ATENAS MARANHENSE;FAMA;MA
47264,50665;FACULDADE CIODONTO;-;PR
47268,38111;FACULDADE SALESIANA DO NORDESTE;FASNE;PE
47272,25557;FACULDADE SANTÍSSIMO SACRAMENTO;FSSS;BA
47276,13003;FACULDADE ANHANGUERA DE SERTÃOZINHO;FASERT;SP
47280,00449;Faculdade Estácio Euro- Panamericana de Humanidades e Tecnologias - Estácio EUROPAN;EUROPAN;SP
47283,87895;FACULDADE DE CIÊNCIAS HUMANAS E SOCIAIS;FUCAMP;MG
47287,75341;FACULDADE DE TECNOLOGIA E CIÊNCIAS;FTC SALVADOR;BA
47291,62787;INSTITUTO PARAIBANO DE ENSINO RENOVADO;INPER;PB
47295,50232;FACULDADE ALFACASTELO;FCGB;SP
47299,37678;FACULDADE MÓDULO PAULISTA;FMP;SP
47303,25124;FACULDADE DE RIBEIRÃO PRETO;FABAN;SP
47307,1257;FACULDADE CENECISTA DE VILA VELHA;FACEVV;ES
47311,00016;ESCOLA SUPERIOR DE ADMINISTRAÇÃO, MARKETING E COMUNICAÇÃO DE UBERLÂNDIA;ESAMC DE UBERLÂNDIA;MG
47314,87462;FACULDADE DE CIÊNCIAS SOCIAIS DE FLORIANÓPOLIS;FCSF;SC
47318,74908;CENTRO UNIVERSITÁRIO LEONARDO DA VINCI;UNIASSELVI;SC
47322,62354;FACULDADES INTEGRADAS INTERAMERICANAS;FAITER;SP
47326,49799;FACULDADE ANCHIETA;IGABC;SP
47330,37245;FACULDADE IBMEC;IBMEC;MG
47334,24691;FACULDADE ESTÁCIO DE SÁ DE VITÓRIA;FESV;ES
47338,12137;FACULDADE DOM BOSCO;FDB;PR
47341,99583;FACULDADE PARAÍSO;FAP;RJ
47345,87029;FACULDADE DE JAGUARIÚNA;FAJ;SP
47349,74475;FACULDADE INTERNACIONAL DE CURITIBA;FACINTER;PR
47353,61921;FACULDADE PITÁGORAS DE UBERLÂNDIA;PIT UBERLÂNDIA;MG
47357,49366;FACULDADE ALVES FARIA;ALFA;GO
47361,36812;FACULDADE CATÓLICA SALESIANA DO ESPÍRITO SANTO;;ES
47365,24258;FACULDADE ESTÁCIO DE SÁ DE VILA VELHA;FESVV;ES
47369,11704;FACULDADE DE ADMINISTRAÇÃO DE SANTA CRUZ DO RIO PARDO;FASC;SP
47372,9915;INSTITUTO DE ENSINO SUPERIOR E FORMAÇÃO AVANÇADA DE VITÓRIA;FAVI;ES
47376,86596;FACULDADE ANHANGUERA DE TABOÃO DA SERRA;FATS;SP
47380,74042;FACULDADE DE ENSINO SUPERIOR DE SÃO MIGUEL DO IGUAÇU;FAESI;PR
47384,61488;FACULDADE LATINO AMERICANA DE EDUCAÇÃO;FLATED;CE
47388,48933;FACULDADE PITÁGORAS DE JUNDIAÍ;PIT JUNDIAÍ;SP
47392,36379;FACULDADE DOUTOR LEOCÁDIO JOSÉ CORREIA;FALEC;PR
47396,23825;FACULDADE MAURÍCIO DE NASSAU DE MACEIÓ;;AL
47400,11271;FACULDADE DE MEDICINA VETERINÁRIA E ZOOTECNIA;FAMED;SP
47403,98717;INSTITUTO CENECISTA FAYAL DE ENSINO SUPERIOR;IFES;SC
47407,86163;FACULDADE PROJEÇÃO DE CEILÂNDIA;FACEB;DF
47411,73609;FACULDADE METROPOLITANA DE MARINGÁ;UNIFAMMA;PR
47415,61055;FACULDADE ESTÁCIO DE SÁ DE BELO HORIZONTE;FESBH;MG
47419,485;FACULDADE ESTÁCIO DE SÁ DE SANTA CATARINA;FESSC;SC
47423,35946;INSTITUTO DE CIÊNCIAS JURÍDICAS E SOCIAIS PROFESSOR CAMILLO FILHO;ICF;PI
47427,23392;FACULDADE VALE DO CRICARÉ;F.V.C.;ES
47431,10838;FACULDADE DE EDUCAÇÃO DE PORTO VELHO;UNIRON;RO
47434,98284;FACULDADE DE VINHEDO;FV;SP
47438,8573;FACULDADE SANTA TEREZINHA;FAST;DF
47442,73176;FACULDADE DE PATO BRANCO;FADEP;PR
47446,60622;FACULDADE FIA DE ADMINISTRAÇÃO E NEGÓCIOS;FFA;SP
47450,48068;INSTITUTO DE ESTUDOS SUPERIORES DA AMAZÔNIA;IESAM;PA
47454,35513;FACULDADE DE DIREITO FRANCISCO BELTRÃO;CESUL;PR
47458,22959;FACULDADES INTEGRADAS OLGA METTIG;FAMETTIG;BA
47462,10405;FACULDADE DE CIÊNCIAS CONTÁBEIS DE AFONSO CLÁUDIO;ISEAC;ES
47465,97851;FACULDADE SENAI DE SÃO PAULO;SENAI;SP
47469,85297;FACULDADE CENECISTA DE JOINVILLE - FACE;FCJ;SC
47473,72743;FACULDADE DE FILOSOFIA, CIÊNCIAS E LETRAS NOSSA SENHORA APARECIDA;FNSA;SP
47477,60189;FACULDADE DE CIÊNCIAS, LETRAS E EDUCAÇÃO DO NOROESTE DO PARANÁ;FACLENOR;PR
47481,47635;FACULDADE SÃO JUDAS TADEU DE PINHAIS;FAPI;PR
47485,3508;FACULDADE DE TELÊMACO BORBA;FATEB;PR
47489,22526;FACULDADE PROJEÇÃO;FAPRO;DF
47493,09972;INSTITUTO DE ENSINO SUPERIOR DE RONDÔNIA;IESUR;RO
47496,97418;FACULDADE FLAMINGO;;SP
47500,84864;CENTRO UNIVERSITÁRIO GERALDO DI BIASE;UGB;RJ
47504,7231;FACULDADE DECISÃO;FADEC;SC
47508,59756;INSTITUTO DE EDUCAÇÃO SUPERIOR DE BOITUVA;FIB;SP
47512,47202;FACULDADE DE EDUCAÇÃO SÃO FRANCISCO;FAESF;MA
47516,34647;FACULDADE DE MEDICINA ESTÁCIO DE JUAZEIRO DO NORTE;FMJ;CE
47520,22093;FACULDADE DE EDUCAÇÃO FÍSICA DE FOZ DO IGUAÇU;FEPI;PR
47524,09539;FACULDADE PIAUIENSE;FAP;PI
47527,96985;FACULDADES INTEGRADAS DO VALE DO RIBEIRA;FIVR;SP
47531,84431;FACULDADE SETE DE SETEMBRO;FA12;CE
47535,71877;UNIVERSIDADE FUMEC;FUMEC;MG
47539,59323;INSTITUTO DE ENSINO SUPERIOR DE JOÃO MONLEVADE;IES/FUNCEC;MG
47543,46769;CENTRO UNIVERSITÁRIO DO ESPÍRITO SANTO;UNESC;ES
47547,34214;ESCOLA SUPERIOR DE ADMINISTRAÇÃO, MARKETING E COMUNICAÇÃO DE SOROCABA;ESAMC  SOROCABA;SP
47551,2166;FACULDADE DE ILHA SOLTEIRA;FAISA;SP
47555,09106;FACULDADE DE SAÚDE, CIÊNCIAS HUMANAS E TECNOLÓGICAS DO PIAUÍ;NOVAFAPI;PI
47558,96552;FACULDADE SUL FLUMINENSE;FASF;RJ
47562,83998;FACULDADE UNIME DE CIÊNCIAS JURÍDICAS;FCJ;BA
47566,71444;FACULDADE VIZINHANÇA VALE DO IGUAÇU;VIZIVALI;PR
47570,5889;FACULDADES INTEGRADAS DE CARATINGA;FIC;MG
47574,46336;FACULDADES INTEGRADAS DE ARARAQUARA;FIAR;SP
47578,33781;FACULDADE UNIME DE CIÊNCIAS SOCIAIS;FCS;BA
47582,21227;FACULDADE DE CIÊNCIAS SOCIAIS APLICADAS;FACISA;BA
47586,08673;FACULDADE ALFREDO NASSER;FAN;GO
47589,96119;FACULDADE EDUCACIONAL DE MEDIANEIRA;FACEMED;PR
47593,83565;CENTRO UNIVERSITÁRIO DO PLANALTO DE ARAXÁ;UNIARAXÁ;MG
47597,71011;INSTITUTO DE ENSINO SUPERIOR BLAURO CARDOSO DE MATTOS;FASERRA;ES
47601,58457;FACULDADE INTERMUNICIPAL DO NOROESTE DO PARANÁ;FACINOR;PR
47605,45903;INSTITUTO FEDERAL DE EDUCAÇÃO, CIÊNCIA E TECNOLOGIA SUL-RIO-GRANDENSE;IFSul;RS
47609,33348;FACULDADE DE CIÊNCIAS E EDUCAÇÃO SENA AIRES;FACESA;GO
47613,20794;FACULDADE DA CIDADE DE SANTA LUZIA;FACSAL;MG
47617,0824;FACULDADE DECISÃO;FADE;PE
47620,95686;FACULDADE DE TECNOLOGIA DE INDAIATUBA;FATEC-ID;SP
47624,83132;FACULDADE DE TECNOLOGIA DE GUARATINGUETÁ;FATEC GT;SP
47628,70578;FACULDADE ENERGIA DE ADMINISTRAÇÃO E NEGÓCIOS;FEAN;SC
47632,58024;UNIVERSIDADE DO VALE DO SAPUCAÍ;UNIVÁS;MG
47636,4547;FACULDADES INTEGRADAS DE TANGARÁ DA SERRA;FITS;MT
47640,32915;FACULDADE DE CIÊNCIAS HUMANAS E SOCIAIS APLICADAS;FACSÃOLUÍS;MA
47644,20361;FACULDADE SEAMA;SEAMA;AP
47648,07807;FACULDADE DE ODONTOLOGIA DE MANAUS;FOM;AM
47651,95253;FACULDADE DE CIÊNCIAS E EDUCAÇÃO DO ESPÍRITO SANTO;UNIVES;ES
47655,82699;FACULDADE SANTA FÉ;CESSF;MA
47659,70145;FACULDADE POLITÉCNICA DE UBERLÂNDIA;FPU;MG
47663,57591;INSTITUTO DE ENSINO SUPERIOR PRESIDENTE TANCREDO DE ALMEIDA NEVES;IPTAN;MG
47667,45037;INSTITUTO DE CIÊNCIAS DA SAÚDE;ICS;MG
47671,32482;FACULDADE CIDADE DE COROMANDEL;FCC;MG
47675,19928;FACULDADE DE ADMINISTRAÇÃO DE NOVA ANDRADINA - FANOVA;FANOVA;MS
47679,07374;FACULDADE VALE DO APORÉ;FAVA;MS
47682,9482;FACULDADE LUTERANA SÃO MARCOS;FALSM;RS
47686,82266;FACULDADE DOS CERRADOS PIAUIENSES;FCP;PI
47690,69712;FACULDADE DAS ATIVIDADES EMPRESARIAIS DE TERESINA;FAETE;PI
47694,57158;FACULDADE EDUCACIONAL DE ARAPOTI;FATI;PR
47698,44604;FACULDADE SUL BRASIL;FASUL;PR
47702,3205;FACULDADE ADVENTISTA PARANAENSE;IAP;PR
47706,19495;FACULDADE ASTORGA;FAAST;PR
47710,06941;INSTITUTO SUPERIOR DO LITORAL DO PARANÁ;ISULPAR;PR
47713,94387;FACULDADE ANGEL VIANNA;FAV;RJ
47717,81833;INSTITUTO BLUMENAUENSE DE ENSINO SUPERIOR;IBES;SC
47721,69279;FACULDADE ERNESTO RISCALI;FAER;SP
47725,56725;FACULDADE SANTA RITA;FASAR;SP
47729,44171;FACULDADE NETWORK;NWK;SP
47733,31617;FACULDADE DO INTERIOR PAULISTA;FIP;SP
47737,19062;FACULDADE DE CIÊNCIAS AGRÁRIAS DE ANDRADINA;FCAA;SP
47741,06508;FACULDADE MARECHAL RONDON;FMR;SP
47744,93954;FACULDADE REUNIDA;FAR;SP
47748,814;FACULDADE DE CIÊNCIAS HUMANAS DE AGUAÍ;FACHA;SP
47752,68846;FACULDADE PITÁGORAS DE LONDRINA;;PR
47756,56292;FACULDADE BATISTA DA SERRA;FABAVI;ES
47760,43738;CASTELLI ESCOLA SUPERIOR DE HOTELARIA;CASTELLI ESH;RS
47764,31184;FACULDADE DE CIÊNCIAS JURÍDICAS E SOCIAIS DE MACEIÓ;FAMA;AL
47768,18629;FACULDADE DO AMAZONAS;IAES;AM
47772,06075;FACULDADE HÉLIO ROCHA;FHR;BA
47775,93521;FACULDADE DE CIÊNCIAS HUMANAS E SOCIAIS;FACULDADE AGES;BA
47779,80967;FACULDADE SOCIAL DA BAHIA;FSBA;BA
47783,68413;FACULDADE DE TECNOLOGIA E CIÊNCIAS DE ITABUNA;FTC;BA
